views,likes,media,comments,url,caption,post_datetime
na,2423,image,32,https://www.instagram.com/p/BKtdkoXDbLN/?taken-by=blackberry,"We’ve been talking a lot lately about our BlackBerry enterprise software, but we still get “fired up” when we see what our smartphone fans are up to! So tag us in your photos with #BlackBerryLifeStyle and the BlackBerry device you used to take the photo, and you might get featured on our page! Shot taken by Jeff Gilchrist using #DTEK50",2016-09-23T19:34:25.000Z
na,1830,image,8,https://www.instagram.com/p/BK1YF0pD9Oc/?taken-by=blackberry,Enterprise mobility management is essential to keep your business secure. So don’t let your current #EMM solution hold you down. See why security-minded organizations are switching to #BlackBerry by clicking the link in our bio.,2016-09-26T21:20:27.000Z
na,4092,image,113,https://www.instagram.com/p/BIs0A33D98R/?taken-by=blackberry,"For a limited time only, you can receive BlackBerry mobile power charger for FREE, when you pre-order the new #DTEK50 by #BlackBerry, the world's most secure Android smartphone. #TeamBlackBerry Link in the bio",2016-08-04T20:28:29.000Z
na,2907,image,56,https://www.instagram.com/p/BIvAhw_juO-/?taken-by=blackberry,"Want a chance to become our BlackBerry Fan Of The Month and win a free device? This month, all you need to do snap a picture of your BB device in a cool location! And don’t forget to use #BBFOTM when you post your picture! Photo by @BlackBerry_Russia #PRIV #TeamBlackBerry",2016-08-05T16:56:19.000Z
na,2227,image,27,https://www.instagram.com/p/BI22Uq2DDqn/?taken-by=blackberry,It’s Monday and we’re 💭of Singapore. Where would you rather be right now? 📸 #PRIV by @gaowennn #BBScapes,2016-08-08T18:01:04.000Z
na,4023,image,117,https://www.instagram.com/p/BI5WXI-DqWw/?taken-by=blackberry,"A picture of a phone, or a picture of a picture of a phone? 😆 Creative 📸 @dzarulazwar #BB10 #BlackBerryPassport",2016-08-09T17:19:30.000Z
na,3596,image,70,https://www.instagram.com/p/BI76m-uD13y/?taken-by=blackberry,Want to win a FREE BlackBerry phone? Make sure you keep snapping pics of your BlackBerry in cool locations – just like the Passport below – and tagging it with #BBFOTM. A winner will be chosen at the end of this month! 📸 @vitsix #BlackBerryPassport #BBScapes,2016-08-10T17:14:43.000Z
na,3004,image,29,https://www.instagram.com/p/BJN3ESEjmep/?taken-by=blackberry,"A driver’s main focus should be on driving. 🚘 Software from QNX by BlackBerry helps make this possible by powering real-time heads-up displays (on your car windshield), and state-of-the-art acoustics systems that allow you to communicate with your passengers without even turning your head! For more information check out the video in our bio!",2016-08-17T16:30:06.000Z
na,3040,image,52,https://www.instagram.com/p/BJQyogIjZU2/?taken-by=blackberry,"does more than just make phones. BlackBerry Radar is a device that allows trucking companies to track the inventory in their trailers and containers in real-time, saving time and money! If you want to know more, click the link in our bio. #TeamBlackBerry #BlackBerryRadar",2016-08-18T19:49:05.000Z
na,2883,image,45,https://www.instagram.com/p/BJTQXHQD697/?taken-by=blackberry,“When it comes to security it is important who you stand behind.” We couldn’t have said it any better! 🙌 Thanks @bbryflow #PRIV #BlackBerrySecure,2016-08-19T18:47:20.000Z
na,1697,image,9,https://www.instagram.com/p/BJa7lA6j5oQ/?taken-by=blackberry,"uses devices, like smoke detectors, to gather data in real time. AtHoc then analyzes the data and alerts emergency first responders and other authorities of potential threats, saving lives. #AtHoc #TeamBlackBerry",2016-08-22T18:19:39.000Z
na,1907,image,21,https://www.instagram.com/p/BJgA_injHV_/?taken-by=blackberry,"Ever worry that your sensitive work documents could be hacked? BlackBerry offers a perfect solution with Good software, creating a secure work space on your mobile device! For more information check out the link in our bio. #GoodPoweredByBlackBerry #TeamBlackBerry",2016-08-24T17:43:10.000Z
na,2554,image,29,https://www.instagram.com/p/BJlBtYTDQAK/?taken-by=blackberry,Happy Friday! 🎈 shot by BlackBerry employee Julian Di Leonardo with the #DTEK50 #BBScapes,2016-08-26T16:25:38.000Z
na,2133,image,22,https://www.instagram.com/p/BJtA0KyDlsC/?taken-by=blackberry,"The U.S. Army trusts AtHoc, the crisis communications division of BlackBerry, to protect nearly 600,000 personnel worldwide.  #AtHoc #TeamBlackBerry #GovTrusted",2016-08-29T18:51:44.000Z
na,2342,image,23,https://www.instagram.com/p/BH5K3XdDVhF/?taken-by=blackberry,"If you’re taking beautiful shots like this on your #PRIV, you’re “dewing” it right. Thanks @jaro_photography! #BBScapes #BlackBerryPRIV",2016-07-15T19:07:39.000Z
na,3266,image,26,https://www.instagram.com/p/BIAyk4dj4xl/?taken-by=blackberry,"The annual #BBSecurity Summit returns to New York City tomorrow July 19 starting at 11 am ET/8 am PT. There will be more than 20 presentations, keynotes and roundtable talks led by experts from Booz Allen, NYC Department of IT and Telecommunications, Mackenzie Health, Google, Microsoft, Samsung, BlackBerry, and more. They’ll discuss today’s mobile threat landscape and what you need to know to manage mobile security. 
Follow the event live tomorrow on @BlackBerry4Biz on Twitter. And it’s not too late to sign up! Check out our blog! Link in the bio. 
Shot taken by @bskphoto",2016-07-18T18:09:20.000Z
na,1733,image,51,https://www.instagram.com/p/BIDdTdnjCJ8/?taken-by=blackberry,"Rudy Giuliani, former NYC Mayor, and CEO John Chen at the #BBSecurity Summit today, July 19. #BlackBerry “is on the cutting edge of thwarting crime,” said Giuliani. “In the world of security, [BlackBerry] is amazing.” Read the BlackBerry Business blog to learn more.",2016-07-19T19:01:11.000Z
10392,1209,video,24,https://www.instagram.com/p/BIGPPxdD1CB/?taken-by=blackberry,"At the Security Summit yesterday, we had an epic showdown between Man and Tea Kettle… Yes, a Tea Kettle! Why? To show how anything that can connect to your Wi-Fi – like modern “smart” kitchen gadgets – can be compromised, and turned into a gateway for hackers to steal your email, financial details, and more. To learn more about our Security Summit check out the link in our bio. #BlackBerry #BBSecurity #Security",2016-07-20T20:56:04.000Z
na,2552,image,65,https://www.instagram.com/p/BIIwE1YjFjh/?taken-by=blackberry,"#DidYouKnow? BlackBerry’s mobile management software secures EVERY major device out there, including BlackBerry and Android devices, iPhones and iPads, and even Apple Watches! So shared Frank Cotter, VP of mobile computing, at the #BBSecuritySummit on Tuesday.",2016-07-21T20:21:25.000Z
na,3487,image,84,https://www.instagram.com/p/BIS3G8ZjNhK/?taken-by=blackberry,Hope your week is starting off with a pop!💡Courtesy of @fadzhery #BlackBerryPRIV #PRIV,2016-07-25T18:35:16.000Z
na,3780,image,224,https://www.instagram.com/p/BIVGcYXDy97/?taken-by=blackberry,"Ultra-Thin, Ultra-Secure, and Ultra-Affordable: Say Hello to the New #DTEK50 by #BlackBerry. Boasting a 13MP Rear Camera, Ultra-Sharp Screen, and Potential for Up to 2 TB of Storage. Check it out! Link in our Bio.",2016-07-26T15:27:45.000Z
na,4306,image,252,https://www.instagram.com/p/BIYQTgujDh-/?taken-by=blackberry,"Have you heard? We launched the DTEK50 yesterday! We would love to hear what you think, so drop your comments and questions below. For more information check out the link in our bio, or tune in tomorrow to our live Q&A webcast with our VP of devices, Alex Thurber at 2pm ET/11am PT #DTEK50 #BlackBerry",2016-07-27T20:51:39.000Z
na,3429,image,80,https://www.instagram.com/p/BIazWh1jgOh/?taken-by=blackberry,We had an awesome time at our Facebook Live DTEK50 Q&A with our VP of Device Sales Alex Thurber. If you missed it check out the link in the bio. P.S Alex mentions something about a new keyboard device coming before the end of this fiscal year… 👀 #DTEK50 #BlackBerry 📸 Taken with #PRIV,2016-07-28T20:36:22.000Z
na,2568,image,58,https://www.instagram.com/p/BIdFznrDcbG/?taken-by=blackberry,Our new #DTEK50 is thinner and lighter than the Samsung Galaxy S7! It’s also the most secure Android phone around. Learn more by watching our DTEK50 videos on our YouTube channel. Link in our bio.,2016-07-29T17:56:07.000Z
na,2393,image,23,https://www.instagram.com/p/BIkztC7DxWX/?taken-by=blackberry,Start your Monday with some ☀️ and 🌊! Courtesy of @markppg #PRIV #BBscapes #BlackBerry,2016-08-01T17:51:51.000Z
na,2893,image,142,https://www.instagram.com/p/BIqPDvujHhN/?taken-by=blackberry,"Get productive! We are bringing our unified inbox app BlackBerry Hub to OTHER Android smartphones (must run Marshmallow 6.0, meet certain performance criteria). Engadget called Hub the “solution to messaging’s Mission Impossible.” Download today at the Google Play Store and follow the instructions. For more information check out our blog. Link in the bio #BlackBerryHub #TeamBlackBerry",2016-08-03T20:27:05.000Z
na,2645,image,71,https://www.instagram.com/p/BHQGojzDMAg/?taken-by=blackberry,"#TeamBlackBerry, securing the streets of NYC",2016-06-29T20:21:49.000Z
na,2444,image,30,https://www.instagram.com/p/BHVBMEyjNMd/?taken-by=blackberry,Great picture of @ehsanlf & @miinaamo posted on @blackberry_iran,2016-07-01T18:10:27.000Z
na,2572,image,41,https://www.instagram.com/p/BHfavOEDBrp/?taken-by=blackberry,"Capture all the little details (and the really big ones!) with your #PRIV. Taken by @lobstercrossing and @friend_tribe_rules in San Francisco, California",2016-07-05T19:06:06.000Z
na,1883,image,13,https://www.instagram.com/p/BHiUwc0DEEv/?taken-by=blackberry,"A peaceful moment for 🐫 day shot with #Passport in Oakville, Toronto, by @lexrajah",2016-07-06T22:11:34.000Z
na,1042,image,10,https://www.instagram.com/p/BHkZYBDjEZA/?taken-by=blackberry,Did you know? Now you can also follow us on #Pinterest at www.pinterest.com/blackberrypins/. #TeamBlackBerry repin our posts today!,2016-07-07T17:30:24.000Z
na,1821,image,24,https://www.instagram.com/p/BHk_FB4j-yD/?taken-by=blackberry,"We love seeing pictures that fans take with their devices! Post your beautiful outdoor shots using #BBScapes – we’ll feature the best ones on our page. Or use #BlackBerryPRIV, #BlackBerryPassport, etc. for pics taken with the corresponding BlackBerry device.",2016-07-07T22:59:51.000Z
na,4698,image,125,https://www.instagram.com/p/BHm9ZpeDiZt/?taken-by=blackberry,"Some things in life are timeless, like the precision and feel of a great keyboard. Our keyboards are here to stay. Photo taken by @hauta_ #BlackBerryPassport",2016-07-08T17:23:40.000Z
na,4877,image,128,https://www.instagram.com/p/BHnotRED-w9/?taken-by=blackberry,"Can you guess which K-Pop star has 4 BlackBerry phones? A couple of hints…She’s a member of a group of (originally) 9 girls that is considered Asia’s biggest pop group of the decade .... Hyoyeon Kim (@watasiwahyo) from Girls’ Generation, who loves her Porsche Design #BlackBerryPRIV #BlackBerryPassport",2016-07-08T23:42:05.000Z
19122,2058,video,30,https://www.instagram.com/p/BHu05c8jUeP/?taken-by=blackberry,"High-end fashion magazine, Harper’s @BazaarIndia, shows how you can pair a #PRIV to augment the new #Breitling US$9,000 connected Swiss watch, the Cockpit Exospace B55. #smartwatch",2016-07-11T18:43:18.000Z
na,3739,image,117,https://www.instagram.com/p/BHxxuiODhzE/?taken-by=blackberry,"Running our secure flavor of Android, #BlackBerryPRIV allows you to chase your dreams of becoming a Pokemon master! #TeamBlackBerry #PokemonGo Let us tag along on your journey by using #BBPokemonGo",2016-07-12T22:13:19.000Z
na,2433,image,192,https://www.instagram.com/p/BH0XhzgDNRK/?taken-by=blackberry,Our Commitment to the Quintessential #BlackBerry Experience (INCLUDING #BB10) #BBFactCheck Link to full article by Marty Beard in bio,2016-07-13T22:22:06.000Z
na,2622,image,48,https://www.instagram.com/p/BH2_usgD4cO/?taken-by=blackberry,"Wow! Gorgeous shot. #TeamBlackBerry, show us more! #BB10 💗. Photo taken by @filmedbythomas #BlackBerryPassport",2016-07-14T22:51:52.000Z
na,3941,image,100,https://www.instagram.com/p/BGfBH2MGrBK/?taken-by=blackberry,Grab your #Passport this summer and get ready to travel! Thanks to @2spseb #BlackBerry,2016-06-10T18:50:53.000Z
na,1924,image,32,https://www.instagram.com/p/BGmvfmNmrAE/?taken-by=blackberry,"No filter needed for this beautiful panoramic shot of the Wailua waterfall in Kauai, Hawaii taken with #PRIV",2016-06-13T18:50:45.000Z
na,2871,image,99,https://www.instagram.com/p/BGr7bCxmrHz/?taken-by=blackberry,#BlackBerryPassport Silver Edition,2016-06-15T19:11:12.000Z
na,1564,image,19,https://www.instagram.com/p/BGxMXqYmrFV/?taken-by=blackberry,"Rose garden photo via @austriker, shot with #PRIV and it's 18MP rear facing camera",2016-06-17T20:15:29.000Z
na,2480,image,58,https://www.instagram.com/p/BG0hYSomrNZ/?taken-by=blackberry,What are you planning on giving Dad this Father's Day? Hint:,2016-06-19T03:16:48.000Z
8566,1385,video,40,https://www.instagram.com/p/BG7JVspmrMw/?taken-by=blackberry,PRIV™ combines everything you’ve come to expect from BlackBerry with all the apps and great experiences of Android. #TeamBlackBerry #BlackBerryPRIV #PRIV,2016-06-21T17:01:24.000Z
na,3550,image,46,https://www.instagram.com/p/BG9sjbbGrBq/?taken-by=blackberry,Keep pushing Friday is almost here! Shot taken by @965toys #humpday #TeamBlackBerry #PRIV #BlackBerryPRIV,2016-06-22T16:47:36.000Z
na,1898,image,34,https://www.instagram.com/p/BHBFjSHDkL6/?taken-by=blackberry,"Comedian and actor Cedric the Entertainer mugging with his #BlackBerry #PRIV smartphone, at the Joe Carter Classic golf tournament in Toronto on June 22nd, co-sponsored by BlackBerry.",2016-06-24T00:23:45.000Z
na,1873,image,34,https://www.instagram.com/p/BHC33Vfjfoi/?taken-by=blackberry,"George “G.Lo” Lopez found time in between selling-out comedy concerts to check out the #BlackBerry #PRIV smartphone. Shot June 22nd at the Joe Carter Classic golf tournament in Toronto, co-sponsored by BlackBerry.",2016-06-24T17:02:38.000Z
na,2398,image,33,https://www.instagram.com/p/BHN7CLVjJow/?taken-by=blackberry,"Capturing the sights and sounds of NYC at #brookfieldplace, home of our first #BlackBerryShop fully dedicated to our revolutionary secure smartphones

#BlackBerryPriv @brookfieldplny #BlackBerryTakesNewYork",2016-06-29T00:01:59.000Z
na,2953,image,66,https://www.instagram.com/p/BHN7p57DzOZ/?taken-by=blackberry,"It's time to get reacquainted, NYC. Stop by our #BlackBerryShop in Brookfield Place and see what we've been up to!

#BlackBerryTakesNewYork #batterypark #BlackBerryPriv #BlackBerryPassport #BlackBerryLeap #BlackBerryClassic @brookfieldplny",2016-06-29T00:07:24.000Z
na,2539,image,49,https://www.instagram.com/p/BHQF_GujlaA/?taken-by=blackberry,"BlackBerry is larger than life in Times Square! 
#BlackBerryTakesNewYork #BeSecure #onthestreets #teamblackberry",2016-06-29T20:16:10.000Z
na,3048,image,76,https://www.instagram.com/p/_DtYO9mrMF/?taken-by=blackberry,"BlackBerry #PRIV Powered by #Android
#PrivacyOn",2015-12-09T04:39:06.000Z
na,2223,image,72,https://www.instagram.com/p/_Dt9ismrMz/?taken-by=blackberry,"You're about to experience a whole new BlackBerry. 
#blackberrypriv #touch + #type",2015-12-09T04:44:11.000Z
13672,1691,video,24,https://www.instagram.com/p/_GTf_pGrN2/?taken-by=blackberry,#spotted #PRIV in #nyc,2015-12-10T04:50:41.000Z
na,4058,image,217,https://www.instagram.com/p/_IRCQBGrFm/?taken-by=blackberry,"It's good to be back. #thankyou @thierryhenry

@Regrann from @thierryhenry -  Old school has gone new school. Like it! #Blackberry #Priv #Regrann",2015-12-10T23:07:38.000Z
23788,3028,video,129,https://www.instagram.com/p/BAQxkUCmrMW/?taken-by=blackberry,"BlackBerry #PRIV, now with 1,000,000 apps, powered by #Android
#spotify #uber #instagram #googleplay",2016-01-08T02:57:13.000Z
na,2945,image,107,https://www.instagram.com/p/BAQyM3DmrNO/?taken-by=blackberry,"Play nice.

#applemusic available on #blackberrypriv. Powered by #Android",2016-01-08T03:02:45.000Z
na,1818,image,25,https://www.instagram.com/p/BAbBnXqmrAX/?taken-by=blackberry,@Regrann from @margaret__zhang -  Serious back pain by way of serious #zhangflat business for this month's @glamourmag 😳📸 #Regrann,2016-01-12T02:29:51.000Z
8933,1677,video,79,https://www.instagram.com/p/BAvfvbgmrNl/?taken-by=blackberry,BlackBerry #PRIV coming to @tmobile next week! Details on the #InsideBlackBerry blog. xoxo ,2016-01-20T01:17:54.000Z
na,2632,image,122,https://www.instagram.com/p/BA_X_GxmrN5/?taken-by=blackberry,BlackBerry #PRIV launching @tmobile today!,2016-01-26T05:17:59.000Z
11513,1525,video,52,https://www.instagram.com/p/BBll6QtmrCx/?taken-by=blackberry,"Hear Nothing, See Nothing, Say Nothing
BlackBerry #PRIV Powered by #Android  #PrivacyOn",2016-02-10T01:30:48.000Z
9297,1197,video,46,https://www.instagram.com/p/BB-66SIGrKK/?taken-by=blackberry,"Don't miss the last day of February deal for Canada, France, Germany, Spain, Italy and Netherlands! For US and UK, the deal continues till 11:59 PST on February 29th. Shop now on your local ShopBlackBerry.com for more details! #Priv #BlackBerry #passport #sale #deal #February",2016-02-19T21:35:19.000Z
36093,3867,video,307,https://www.instagram.com/p/BCfa-oNmrGN/?taken-by=blackberry,"Attention, fans of Priv and Verizon! Your wait is over: BlackBerry Priv is launching on Verizon today!
Available online starting March 3 and in stores starting March 11. 
To stay tuned on Priv's availability in your region, check out back.by/PRIV
#priv @verizon #BlackBerry",2016-03-03T12:31:14.000Z
na,1985,image,30,https://www.instagram.com/p/-o-rx_mrG1/?taken-by=blackberry,"My Privacy

#rainyday #thanksgivingweekend #inspired #PRIV",2015-11-28T19:30:49.000Z
na,1914,image,8,https://www.instagram.com/p/-qMryFmrBn/?taken-by=blackberry,"BlackBerry delivers trusted security for the MERCEDES AMG PETRONAS Formula One Team.

#MercedesAMGF1 #Petronas #PRIV #PrivacyOn #FormulaOne #F1 #AbuDhabiGP",2015-11-29T06:52:24.000Z
na,2093,image,23,https://www.instagram.com/p/-rN_4bmrKF/?taken-by=blackberry,"Congratulations to Nico Rosberg and the MERCEDES AMG PETRONAS Formula One Team for their victory at the Abu Dhabi GP

#MercedesAMGF1 #Petronas #PRIV #PrivacyOn #FormulaOne #F1 #AbuDhabiGP",2015-11-29T16:23:07.000Z
na,2204,image,44,https://www.instagram.com/p/-uBxlkGrJJ/?taken-by=blackberry,"Last days to save up to 20% on select BlackBerry 10 smartphones at our ShopBlackBerry Holiday Sale! Ends Dec 1

#BlackBerryPassport #BlackBerryClassic #BlackBerryLeap #backtowork #cybermonday #happyholidays",2015-11-30T18:34:02.000Z
na,1971,image,28,https://www.instagram.com/p/-wn0-RGrDc/?taken-by=blackberry,"Lead Industrial Designer, Michael DeFazio on the engineering of the PRIV: 
Our mechanical engineers pushed the limits of materials and processes to provide an uncompromised all-touch experience, with the added benefit of a physical keyboard. Using materials such as woven glass composite, the team successfully packed an impressive 3410mAh battery into a slider form factor thinner than some competitive full-touch devices. This was truly a technical feat which enabled a compelling industrial design.

#InsideBlackBerry #PRIV #industrial #engineering #design",2015-12-01T18:45:01.000Z
na,1677,image,13,https://www.instagram.com/p/-woHtqGrED/?taken-by=blackberry,"Lead Industrial Designer Michael DeFazio on the inspiration behind the PRIV: 
It is a contemporary take on a familiar form factor, the slider. [...]. We wanted the industrial design to reflect the notion of Privacy. It is sleek and quiet with subtle elements of intrigue that make you want to pick it up.

#InsideBlackBerry #PRIV #design #inspiration #sketch",2015-12-01T18:47:35.000Z
na,2302,image,39,https://www.instagram.com/p/-wojxBGrE5/?taken-by=blackberry,"Lead Industrial Designer Michael DeFazio on design goals for the PRIV: 
The main goal for PRIV was to create a device that is an uncompromised experience in both states, touch and type.

I believe this is measured through the surprise users get when they reveal the keypad for the first time. The form is uninterrupted except for a small step at the bottom of the device, providing visual and ergonomic affordance to indicate where the display slides, magically exposing the touch-sensitive keyboard. 
#InsideBlackBerry #PRIV #industrial #design #interview",2015-12-01T18:51:25.000Z
7552,928,video,37,https://www.instagram.com/p/-1zi6umrKJ/?taken-by=blackberry,"Ask us anything on Reddit in the r/Android subreddit. TODAY at 2pm EST

Whether you’re curious about how to get the most out of PRIV’s many cutting-edge features, interested in understanding more about BlackBerry’s security, or learning about updates to the PRIV’s Android OS, we’ll answer your questions as best as we can.

To attend, login to Reddit, go to the r/Android subreddit and access the AMA thread.

@reddit #BlackBerry #PRIV #Android #askmeanything",2015-12-03T19:03:37.000Z
na,1288,image,12,https://www.instagram.com/p/-46VypGrAc/?taken-by=blackberry,@Regrann from @dujourmedia -  @hilaryswank looking stunning as always on the red carpet at our @artbasel Miami Beach kickoff party at @delanobeachclub. Powered by BlackBerry PRIV. #PRIV #BlackBerry #50bleu #ArtBasel #Regrann,2015-12-05T00:00:43.000Z
na,1226,image,6,https://www.instagram.com/p/-5QMTTmrE-/?taken-by=blackberry,"@adrienbrody & @bruce_weber at the @dujourmedia annual @artbasel kickoff party in Miami Beach, presented by BlackBerry PRIV.
#blackberrypriv #artbasel #artbasel2015 @delanobeachclub",2015-12-05T03:11:39.000Z
na,1259,image,16,https://www.instagram.com/p/-5UeJemrNf/?taken-by=blackberry,"@hilaryswank at the @dujourmedia #artbasel kickoff party. Presented by BlackBerry PRIV.

#artbasel2015 #blackberrypriv #miamibeach",2015-12-05T03:49:03.000Z
na,2319,image,46,https://www.instagram.com/p/_CywArmrML/?taken-by=blackberry,"Jadakiss hanging with his #PRIV, wishing all a happy holiday from New York City.

@therealkiss #nyc #happyholidays",2015-12-08T20:06:48.000Z
na,2473,image,32,https://www.instagram.com/p/-X-A_rGrNE/?taken-by=blackberry,"The stories you don't tell.

#NYC #SaturdayNight #PrivacyOn",2015-11-22T04:57:53.000Z
na,2877,image,74,https://www.instagram.com/p/-ZOAahGrM2/?taken-by=blackberry,"I'm only talking to my dog today.

#SanFrancisco #Sunday #jackrussell #friendsgiving #MyPrivacy powered by #Android @att",2015-11-22T16:36:52.000Z
na,2783,image,55,https://www.instagram.com/p/-aVeeTmrHQ/?taken-by=blackberry,#NYC,2015-11-23T03:01:22.000Z
na,1434,image,16,https://www.instagram.com/p/-aVxDkmrHn/?taken-by=blackberry,BlackBerry #PRIV Powered by #Android Available @att #PrivacyOn,2015-11-23T03:03:55.000Z
na,2415,image,32,https://www.instagram.com/p/-cX_juGrLm/?taken-by=blackberry,"18 #megapixel S-K certified #camera with Phase Detect #Autofocus #Optical Image Stabilization, live #filters #exposure control and more. #Panoramic #selfie mode on front facing camera for #wideangle #selfies 
BlackBerry #PRIV Powered by #Android",2015-11-23T22:01:51.000Z
na,3800,image,162,https://www.instagram.com/p/-eoJ1qGrIc/?taken-by=blackberry,"It’s good to be back. ""After using the Priv for a week, I'm definitely a massive fan - this is BlackBerry's best phone in years and one of the most impressive mobiles of 2015"" - Chris Barraclough @recombuofficial

Check out the #InsideBlackBerry blog to see what #UK reviewers are saying about the #PRIV.

#BlackBerry #2015 #comeback",2015-11-24T19:01:32.000Z
na,1943,image,74,https://www.instagram.com/p/-ffm0LGrH1/?taken-by=blackberry,"Better Together

BlackBerry #PRIV Powered by #Android Available @att",2015-11-25T03:06:06.000Z
na,1629,image,29,https://www.instagram.com/p/-hZqWZmrDY/?taken-by=blackberry,#happythanksgiving #oldfriends,2015-11-25T20:52:38.000Z
na,2117,image,45,https://www.instagram.com/p/-iWiURGrDT/?taken-by=blackberry,#PRIV busses being prepped for the holiday rollout throughout America.,2015-11-26T05:44:34.000Z
7085,1827,video,45,https://www.instagram.com/p/-joJUumrDd/?taken-by=blackberry,"Save up to 20% on BlackBerry Passport, BlackBerry Classic and BlackBerry Leap at the ShopBlackBerry holiday sale, now through Dec 1. #blackfriday",2015-11-26T17:37:40.000Z
na,1807,image,23,https://www.instagram.com/p/-mkD8IGrKu/?taken-by=blackberry,"Fall in love again

BlackBerry #PRIV powered by #Android available @att",2015-11-27T20:59:42.000Z
na,2224,image,29,https://www.instagram.com/p/-nI4SKGrPq/?taken-by=blackberry,"Hide.

BlackBerry #PRIV #PrivacyOn",2015-11-28T02:21:26.000Z
na,1470,image,39,https://www.instagram.com/p/9opM8vGrGH/?taken-by=blackberry,#PRIV #PrivacyOn #PoweredByAndroid pre-order yours today. BlackBerry.com/PrivacyOn,2015-11-03T19:51:43.000Z
na,1986,image,83,https://www.instagram.com/p/9qo--fmrJc/?taken-by=blackberry,Have you pre-ordered yours yet? #PRIV #PrivacyOn #PoweredByAndroid,2015-11-04T14:28:17.000Z
na,2423,image,109,https://www.instagram.com/p/9xNKv-GrP9/?taken-by=blackberry,"Wall Street Journal declares: #PRIV ""challenges Apple's ruling #iPhone."" blck.by/1PftSnt",2015-11-07T03:39:55.000Z
na,1870,image,49,https://www.instagram.com/p/-ErOzLmrMu/?taken-by=blackberry,Pray for Paris #prayforparis #paris #prayfortheworld #jesuisparis,2015-11-14T17:08:11.000Z
na,2441,image,72,https://www.instagram.com/p/-MHmDVmrAw/?taken-by=blackberry,#ABC weather anchor @Ginger_zee showing off #PRIV during Good Morning America's #gma40 celebrations. The world's most secure smartphone powered by Android. Exclusive to @att in the U.S.,2015-11-17T14:30:42.000Z
na,1355,image,25,https://www.instagram.com/p/-OuHhvmrEi/?taken-by=blackberry,COO Marty Beard joins @Ginger_zee in celebrating #gma40 with #PRIVs in Times Square! The world's most secure smartphone powered by Android. Exclusive to @att in the U.S.,2015-11-18T14:45:48.000Z
