views,likes,media,comments,url,caption,post_datetime
na,2347,image,20,https://www.instagram.com/p/BXgmaLHATZ3/?taken-by=blackberry,"BlackBerry doesn’t just provide secure software - we also provide cybersecurity consulting services. We’re flying up that list. The latest Cybersecurity 500 rankings put us in the Top 7%, including 3rd among all mobile-focused providers. To learn more, click the link in our bio!",2017-08-07T22:29:38.000Z
na,1484,image,9,https://www.instagram.com/p/BX50RvaAMGa/?taken-by=blackberry,"Police officers on patrol need quick availability to their department’s criminal and developing emergencies database. Making sure they had secure access, however, was a significant roadblock. This major U.S. police department turned to BlackBerry to easily deploy secure, two-factor authentication (2FA). Click the link in our bio to see how.",2017-08-17T17:31:50.000Z
na,1706,image,5,https://www.instagram.com/p/BYJUjteAoTe/?taken-by=blackberry,"Many say the next step in technology’s evolution is the Internet of Things. One resulting issue - addressing the inadequacies of current programming languages and development tools for IoT. To see where we need to start, click the link in our bio.",2017-08-23T18:02:30.000Z
na,1868,image,13,https://www.instagram.com/p/BYOc3dzgb1s/?taken-by=blackberry,"When it comes to security, many of us are like the Jon Snow character on Game of Thrones - we know nothing. HBO recently learned that lesson the hard way, suffering a massive cyber-attack that saw the network robbed of 1.5 terabytes of data. How can you avoid that fate? To see how, click the link in our bio.",2017-08-25T17:51:19.000Z
na,1359,image,9,https://www.instagram.com/p/BYboAFOAbag/?taken-by=blackberry,"Practicing proper “data sanitization” at your company can be like washing a pet: more challenging than you might think. Simply hitting the Delete button will no longer work, with all of the devices employees carry, and new regulations like GDPR springing into place. To see what it takes to properly sanitize all of your company’s devices, click the link in our bio.",2017-08-30T20:38:44.000Z
na,2071,image,19,https://www.instagram.com/p/BYtVGqGAM_F/?taken-by=blackberry,"BlackBerry's innovations have changed the world more than once - and now, with the Enterprise of Things, we're poised to do so again. As BlackBerry President of Sales and Service Carl Wiese writes, our BlackBerry Secure architecture can help businesses up their cybersecurity game today, and protect all of the connected IoT endpoints they’ll be managing tomorrow. To see why, click the link in our bio!",2017-09-06T17:39:56.000Z
na,1622,image,4,https://www.instagram.com/p/BY6e5CjgJMK/?taken-by=blackberry,"Ford Motors plans - with help from partners like BlackBerry - to build self-driving cars and other vehicles tailor-made to ""improve the movement of people and goods."" But what does that mean, exactly? Click the link in our bio to find out.",2017-09-11T20:15:35.000Z
na,2345,image,14,https://www.instagram.com/p/BZEhs3EgkkP/?taken-by=blackberry,"Today’s vehicles are computers on wheels—with over 100 million lines of software per car. Like computers, they will need to be protected. Click the link in our bio to see how BlackBerry can help make your vehicle – like this Bentley concept car powered and secured by BlackBerry QNX - BlackBerry Secure.",2017-09-15T17:52:33.000Z
na,1474,image,2,https://www.instagram.com/p/BZMYK4EAJKG/?taken-by=blackberry,"Want guaranteed job security? Look for a job in cybersecurity, and you'll never be out of work. It's one of the few industries with a zero percent unemployment rate. That's great for cybersecurity pros...not so much for businesses looking to employ them. What's causing this skill gap? Click the link in our bio to find out.",2017-09-18T19:03:11.000Z
na,1558,image,13,https://www.instagram.com/p/BZWeEu7gTnL/?taken-by=blackberry,"Do you travel on business a lot? If so, I've got some bad news - compared to other employees, you're likelier to have your device stolen or compromised, and thus be the source of a data breach. Don't worry, there's an easy way to address that. Click the link in our bio to see how you can travel safer.",2017-09-22T17:07:11.000Z
na,2349,image,10,https://www.instagram.com/p/BZefbC6AYu_/?taken-by=blackberry,"For years, the FCC has been trying to upgrade the national emergency alert system - to bring mass alerts for severe weather and other emergencies into the digital age. Unfortunately, they've hit some rather powerful roadblocks - namely, wireless carriers. Why exactly do carriers oppose something like this, though? Click the link in our bio to read more.",2017-09-25T19:52:53.000Z
na,2402,image,95,https://www.instagram.com/p/BZ6lsghg06S/?taken-by=blackberry,"Back when the cloud was in its infancy, many regarded it as a security breach waiting to happen. Now, however, experts are positioning it as a key tool in the fight against cybercrime - ransomware especially. To see how, click the link in our bio.",2017-10-06T17:46:26.000Z
na,2842,image,20,https://www.instagram.com/p/BUfHMzKBef-/?taken-by=blackberry,"After large successful hacks like WannaCry, copycats normally emerge. It is important that you learn how to protect yourself from attacks similar to this. For tips and tricks, be sure to click the link in our bio.",2017-05-24T19:03:30.000Z
na,3355,image,19,https://www.instagram.com/p/BVC4YYnhT4C/?taken-by=blackberry,"When disaster strikes, all you can do is hope you can weather the storm. But is it really the truth? Turns out, you can do more to prepare for - and predict - a crisis than you'd think. Click the link in our bio to read more.",2017-06-07T16:26:40.000Z
na,1804,image,7,https://www.instagram.com/p/BVQJIrXBwE9/?taken-by=blackberry,"The BlackBerry Secure story keeps getting better. For the second year in a row, BlackBerry was named a Leader in Gartner’s Magic Quadrant for Enterprise Mobility Management Suites. Our VISION is to offer Unified Endpoint Management that lets companies secure and manage smartphones, PCs, and the coming flood of smart IoT-enabled devices. So we executed and invested on that vision – building and integrating the best technology into an overarching platform that we today call the BlackBerry Enterprise Mobility Suite. To read more, click the link in our bio.",2017-06-12T20:03:12.000Z
na,2222,image,15,https://www.instagram.com/p/BVaKR6rg67N/?taken-by=blackberry,"Mr. Robot is a TV series that follows the exploits of a cybersecurity engineer who moonlights as a hacker by night. Given Hollywood's history with technology, it probably doesn't have anything useful to say about security, right? Wrong, actually. To see why, click the link in our bio.",2017-06-16T17:25:36.000Z
na,1683,image,7,https://www.instagram.com/p/BVkuRsFgbvJ/?taken-by=blackberry,"Canada celebrates its 150th birthday on July 1st. Join us as we celebrate 150 years of Canadian innovation with a fun, out-of-season fact! In 1937, Joseph Bombardier introduced the first snowmobile. Doctors and priests in remote areas were the first customers. #CanadianInnovation If you want to read more about how BlackBerry is celebrating Canada’s 150th birthday, click the link in our bio.",2017-06-20T19:52:33.000Z
na,1657,image,12,https://www.instagram.com/p/BVsl75Lga5Z/?taken-by=blackberry,"Wearable devices like smartwatches and smart glasses may have had a slow start, but things are looking up. According to ABI Research, businesses will start adopting wearable devices the same way they embraced mobile devices. What changed? To find out, click the link in our bio.",2017-06-23T21:13:36.000Z
na,2066,image,8,https://www.instagram.com/p/BWLBoNyg7ut/?taken-by=blackberry,"BlackBerry UEM is our software that helps businesses manage worker smartphones, PCs and other devices. Check out what one of our enterprise customers thinks. “BlackBerry UEM’s interface is POWERFUL and clean, and it’s intuitive enough for end-users to self-provision. We’re going to keep using – and upgrading – for a long time.” - Anthony Albon, IT Support Manager at Angel Trains.  To read the full article, click the link in our bio.",2017-07-05T16:52:47.000Z
na,1295,image,6,https://www.instagram.com/p/BWqfdsJg745/?taken-by=blackberry,"BlackBerry UEM software helps businesses manage employee phones, computers, and other devices. Eduardo Aldao Castillo, Director of Innovation at Spanish bank, ABANCA, says, “UEM checks every box on our list…and BlackBerry’s extensive security certifications speak for themselves. The fact that BlackBerry UEM works so seamlessly with Samsung KNOX is just the ICING ON THE CAKE.” To read more about the success ABANCA has had with BlackBerry UEM, click the link in our bio.",2017-07-17T22:09:57.000Z
na,1379,image,30,https://www.instagram.com/p/BW0dZPCgja7/?taken-by=blackberry,"Selfies while driving are ok when the car is self-driving,right? This shot was taken this morning as the Ontario Premier, Kathleen Wynne, toured our BlackBerry QNX Autonomous Vehicle Innovation Center (AVIC), located in the heart of the emerging connected car innovation cluster of Ottawa, Canada.",2017-07-21T19:04:16.000Z
na,1267,image,14,https://www.instagram.com/p/BXBk6SKAi3G/?taken-by=blackberry,"Earlier this month, it was revealed that British doctors are using Snapchat to share patient x-rays and other scans. That isn't exactly a secure means of communication, and it definitely isn't HIPAA compliant. So why are they doing it? To read the full story, click the link in our bio.",2017-07-26T21:20:05.000Z
na,1619,image,9,https://www.instagram.com/p/BXTHYV_gd9u/?taken-by=blackberry,"“With BlackBerry, we’re meeting and exceeding clients’ demands for world-class security. Our lawyers are relieved knowing that client information is protected on their personal devices and over the air, and that they don’t need to worry about a data breach if they lose their device.” - Partner, Leading Global Law Firm. To read the full story, click the link in our bio!",2017-08-02T16:48:22.000Z
na,2240,image,8,https://www.instagram.com/p/BXYi31ZgS4o/?taken-by=blackberry,"National secrets. Defense plans. Military action. There's a lot of highly-sensitive information military and government officials might discuss over the phone, so they need to be sure no one is listening in. To see how BlackBerry software can help, click the link in our bio.",2017-08-04T19:24:48.000Z
na,2275,image,9,https://www.instagram.com/p/BSzS3UhBSeT/?taken-by=blackberry,"When it comes to balancing security against usability, IT departments are walking a tightrope - too far in either direction, and everything comes crashing down. Mobility is about convenience and security, and enterprises must offer both because employees will find a way to break inconvenient security. To learn more, click the link in our bio.",2017-04-12T22:07:27.000Z
na,2140,image,13,https://www.instagram.com/p/BS_9t5vBBnz/?taken-by=blackberry,"In a scene from the new film “The Fate Of The Furious,” a hacker uses cars’ wireless signals to take control of thousands of random vehicles and turn them into virtual driverless missiles. For once, Hollywood hasn’t blown something completely out of proportion. This type of attack is definitely something that can happen in the near future, say experts. To see how, click the link in our bio.",2017-04-17T20:12:47.000Z
na,2779,image,16,https://www.instagram.com/p/BTFIPpvBwIm/?taken-by=blackberry,"In “The Fate of the Furious,” the villain hacks into and takes control of both cars and a nuclear submarine. Outlandish? Or totally possible? Our experts from BlackBerry QNX have weighed in. Click the link in our bio to see what they think!",2017-04-19T20:20:59.000Z
na,2205,image,12,https://www.instagram.com/p/BTKWA92hvLT/?taken-by=blackberry,"Can you see what's connected to the Internet of Things in this picture? Trick question - it's everything. The idea that our entire world is hackable no longer seems that far-fetched. And yet there's still a shortage of firms working on protecting IoT devices. When it comes to endpoint security, the supply is there, but the demand isn't - that needs to change, or things will get much worse. To read the full story, click the link in our bio.",2017-04-21T20:57:31.000Z
na,1838,image,4,https://www.instagram.com/p/BTXATLNB2rW/?taken-by=blackberry,"Do your eyes glaze 🍩ver whenever someone mentions encryption? Turns out, you’re not the only one nodding off. Across industries, cryptographic software is still being adopted at a painstakingly slow pace. And that’s a very, very bad thing. To read the full story, click the link in our bio.",2017-04-26T18:57:53.000Z
na,1572,image,10,https://www.instagram.com/p/BTj5J0whtzs/?taken-by=blackberry,"Webcams, Wi-Fi printers, and smart fridges are all part of the Internet of Things – AND all have all been hacked. IoT security is a mess – that’s no secret. What steps can YOU take to make your connected devices as secure as possible? This story offers some tips - click the link in our bio.",2017-05-01T19:05:34.000Z
na,2753,image,22,https://www.instagram.com/p/BTo7a5xBxnM/?taken-by=blackberry,"Hackers can now steal your car by tapping into your phone. It sounds like something out of the new Fast & The Furious movie, but it isn’t. How can you protect yourself? To find out, click the link in our bio.",2017-05-03T18:01:35.000Z
na,2746,image,31,https://www.instagram.com/p/BTuDcf3hia7/?taken-by=blackberry,"#SS7 is a core component in many mobile networks, and that's not a good thing. By exploiting its vulnerabilities, hackers can hijack both phone calls and texts. Don't worry - BlackBerry's got you covered with communication solutions such as BBM Enterprise and SecuSuite. To learn more, click the link in our bio.",2017-05-05T17:47:54.000Z
na,2908,image,33,https://www.instagram.com/p/BT11xD4hnqy/?taken-by=blackberry,"Slowly but surely, smartwatches are gaining a foothold in enterprise. Workers are wearing them on the job for quick access to notifications,customer account info, and email. Managed through software like BlackBerry UEM, they’ve the potential for much more, too. To read the full story, click the link in our bio!",2017-05-08T18:22:18.000Z
na,1807,image,13,https://www.instagram.com/p/BT7KN-iF5Uu/?taken-by=blackberry,"With the Internet of Things, modern workplaces have the potential to become like George Orwell's 1984, with 'smart' devices monitoring everything employees do. That'll help protect you or your business against hackers and malicious insiders - but it also has the potential to be a very bad thing. To find out why, click the link in our bio.",2017-05-10T19:57:13.000Z
na,1857,image,12,https://www.instagram.com/p/BUNNTtWhntr/?taken-by=blackberry,"We can see the Internet of Things is arriving, thanks to connected devices such as wirelessly-controlled light bulbs, wearable fitness gadgets, smart fridges, and more. Cloud providers are getting ready. But are their security measures enough to address the risks from tens of billions of new endpoints? And if not, what else can be done? To find out, click the link in our bio.",2017-05-17T20:10:32.000Z
na,2447,image,21,https://www.instagram.com/p/BUaTVrlBHuB/?taken-by=blackberry,"Imagine getting locked out of your computer while all of your data is being held for ransom. You might want to cry, right? Well the scary news is that this has actually happened and the attack is called WannaCry. Hackers have used the vulnerability to infect more than 200,000 computers in 150 countries. To learn everything you wanted to know about WannaCry, click the link in our bio.",2017-05-22T22:13:22.000Z
na,2300,image,31,https://www.instagram.com/p/BQ0-q73hi-z/?taken-by=blackberry,"Wouldn’t it be cool to ditch your wallet all together? The Computer Business Review predicts that using your phone to pay for meals will become the new norm this year.  However, this convenient solution is going to create more avenues for mobile hackers. With that in mind, will you make the switch and ditch your wallets?",2017-02-22T20:46:41.000Z
na,10836,image,461,https://www.instagram.com/p/BRB2z3nBloJ/?taken-by=blackberry,"We know you’ve been waiting for a new phone that combines a physical keyboard with an incredible app ecosystem. Well, your wait will be over soon! Our partner TCL has unveiled the BlackBerry KEYone that runs Android 7.1 Nougat! It boasts a 4.5"" HD touchscreen, touch-enabled physical keyboard, a 12MP rear camera, and support for an extra 2TB of removable storage! To learn more about KEYone, click the link in our bio.",2017-02-27T20:48:08.000Z
na,5690,image,142,https://www.instagram.com/p/BRMCHi5hOF0/?taken-by=blackberry,"“The KeyOne is the first BlackBerry phone that BlackBerry isn’t pushing itself. The past three devices, the BlackBerry Priv, the DTEK50, and the DTEK60, all went through the BlackBerry distribution chain. Now, licensees are responsible for selling the BlackBerry-branded phones through their distribution chain. There’s no difference to the end customer, whether it’s a business or an individual user, as the devices are still available in retail stores, from carriers, and on the open market.”-VentureBeat To learn more about how BlackBerry is moving ahead on smartphones – and how their availability to consumers should be better than ever – click the link in our bio!",2017-03-03T19:39:20.000Z
na,2263,image,11,https://www.instagram.com/p/BRUMdRyh11C/?taken-by=blackberry,"The ""Internet of Things"" is a catch-all term for the network of 'smart' devices able to connect to the Internet. It’s not just smartphones and laptops anymore - think sound systems, smart TVs, smoke detectors, coffee makers, connected cars, industrial robots, etc. Here's the problem: IoT devices often deal with sensitive data - and the software that runs them is often not secure. 
That's where BlackBerry comes in, by providing the secured software and infrastructure that IoT devices run on, both inside and outside of business. We're helping to make the Enterprise of Things a reality, and bring the Internet of Things truly into its own. To learn more about IoT, click on the link in our bio.",2017-03-06T23:43:37.000Z
na,2281,image,18,https://www.instagram.com/p/BRZLOb-BoHy/?taken-by=blackberry,"How would you feel if hackers spied on you via your kids' favorite toy? That may have happened with CloudPets, which allows parents and children to send and receive messages using a teddy bear synced to a mobile device. The maker of internet-connected teddy bears ""left more than 800,000 customer credentials, as well as two million message recordings, totally exposed online for anyone to see and listen."" Still not worried about security in the IoT (Internet of Things) age? Click the link in our bio to read the full story.",2017-03-08T22:09:03.000Z
na,1189,image,15,https://www.instagram.com/p/BRtaxmfBSU4/?taken-by=blackberry,"Is this the face of a happy BlackBerry employee or a Jeopardy winner? The correct answer is: both! Meet Grant McSheffrey, an engineer on our BBM team in Ottawa, who is looking to add to his $53,000 in winnings by getting his third win on the show Thursday night. To read more about Grant, click the link in our bio.",2017-03-16T18:49:44.000Z
na,2520,image,36,https://www.instagram.com/p/BR36vTLh8Ou/?taken-by=blackberry,"“Yay, it’s Monday,” said no one ever. What was the worst Monday you ever had and why?",2017-03-20T20:41:27.000Z
na,1712,image,8,https://www.instagram.com/p/BR9IkAhhHpi/?taken-by=blackberry,"Did you know that BlackBerry’s AtHoc is the first cloud-based solution to receive Crisis Communication Federal Risk and Authorization Management Program (FedRAMP) authorization? The service allows employees at large government agencies and enterprises to easily communicate with each other during a crisis, even interconnecting walkie-talkie-style land-mobile radios operating on different frequencies. To read more, click the link in our bio.",2017-03-22T21:18:26.000Z
na,1945,image,17,https://www.instagram.com/p/BSCLUSJBZlf/?taken-by=blackberry,"If even a highly trained Secret Service agent can’t keep their laptop from being stolen, how can you expect your employees to do any better? What is your enterprise doing to protect its data against the all-too-common scenario of lost or stolen mobile devices? To read more about the incident, click the link in the bio.",2017-03-24T20:18:43.000Z
na,2279,image,16,https://www.instagram.com/p/BSJuN2KBmjy/?taken-by=blackberry,"Did you know that running cloud-based security could save your company money and time? Instead of a huge upfront cost, companies buy subscriptions to solutions such as BlackBerry UEM Cloud. Also, because providing security updates is the cloud provider’s responsibility, IT staff doesn’t have to spend time finding new solutions every time there is a new threat. Click the link in our bio to read more.",2017-03-27T18:38:21.000Z
na,8262,image,266,https://www.instagram.com/p/BSO1XA3hvxW/?taken-by=blackberry,"Even though regular software updates are critical to stopping malware, ""only half of the 1.4 billion Android devices in circulation got an update of any kind during 2016."" That's not the case with Android by BlackBerry devices like DTEK50, DTEK60, and the upcoming TCL-made KEYone, for which BlackBerry publishes monthly OS updates to seal security gaps. To read more, click the link in our bio. Photo by @androidcentral",2017-03-29T18:16:58.000Z
na,2523,image,21,https://www.instagram.com/p/BShMBsMBTae/?taken-by=blackberry,"BlackBerry and Ford have long partnered on connected vehicle technology, and now Ford is taking steps to further leverage BlackBerry expertise. Learn more about how Ford sees the future of autonomous vehicles and why it sees BlackBerry QNX as its best bet for advancing the market. Click the link in our bio.",2017-04-05T21:21:22.000Z
na,1924,image,10,https://www.instagram.com/p/BPV7wiphh2-/?taken-by=blackberry,"In 2016, Tesco Bank halted online banking after 40,000 accounts were compromised -- and half of them were hit by fraudulent transactions -- over one weekend. A total of £2.5m was stolen from 9,000 accounts. Check out these horror stories that may scare your businesses’ security policy straight. To read the full story, click the link in our bio.",2017-01-16T22:53:23.000Z
na,2058,image,17,https://www.instagram.com/p/BPbEyh8h3BU/?taken-by=blackberry,"What could happen if your whole city didn’t have power for a couple of days? That happened to 50 million people in 2003, when an overload caused a blackout in the northeastern U.S. The Electricity Resource Council estimated that episode cost between $4.5 billion and $8.2 billion! Can you imagine what it would cost today, or how things might be even worse if such a blackout was caused by hackers, rather than equipment malfunction? To read the full story about dangerous cyber vulnerabilities in modern power grids, click the link in our bio.",2017-01-18T22:48:30.000Z
na,3951,image,96,https://www.instagram.com/p/BPgClgNB0Zh/?taken-by=blackberry,"Hey BB10 Users: If you’ve recently had some problems with WhatsApp, you may need to update WhatsApp. Please go to BlackBerry World and get the latest version of WhatsApp and also ensure you’re running BB10 version 10.0.10.82 or later. WhatsApp will continue working on BB10 through June, and keep running indefinitely on PRIV, DTEK50 and other Android devices. Photo by @brandon_yeung",2017-01-20T21:05:27.000Z
na,3399,image,10,https://www.instagram.com/p/BPsvE-5BsqU/?taken-by=blackberry,"Trying to be productive on your next business trip? Using in-flight Wi-Fi to work while you travel is like paying to increase your risk of being hacked. This article warns, “Think of connecting to unsecured wireless as walking barefoot or eating off a dirty floor—you're a lot more likely to suffer consequences.” To read the full story, click the link in  our bio.",2017-01-25T19:25:07.000Z
na,1571,image,13,https://www.instagram.com/p/BPyWjpjjo_h/?taken-by=blackberry,"Clear lines of communication can make a huge difference when your nonprofit provides medical care to the victims of floods, earthquakes, and a host of other emergencies. This is why veteran paramedic and internationally recognized humanitarian Rahul Singh of GlobalMedic chose BBM to power his organization's communications. To read the full story, click the link in our bio.",2017-01-27T23:46:17.000Z
na,2352,image,78,https://www.instagram.com/p/BP52Op4jZse/?taken-by=blackberry,"“At BlackBerry, more than half of the executive team and many of our employees – including myself – are immigrants, so we see firsthand every day the value and benefits of legal immigration. While there is a need to protect citizens, we must also preserve our strength in diversity.” To read our CEO John Chen’s full statement, click the link in our bio.",2017-01-30T21:37:44.000Z
na,1900,image,15,https://www.instagram.com/p/BQD2YQdD-R5/?taken-by=blackberry,"In business, the only way to ensure your manufacturing partner is making your products to your exact specifications is to share your proprietary design documents with them. But when your contract manufacturer is located thousands of miles away and has many clients, how can you protect your key intellectual property from falling into the hands of your competition? To find the answer, click the link in our bio.",2017-02-03T18:51:27.000Z
