views,likes,media,comments,url,caption,post_datetime
na,2808,image,41,https://www.instagram.com/p/BQLxp31hJ2e/?taken-by=blackberry,"India has the fastest-growing smartphone market in the world and is the newest frontier for BlackBerry-branded smartphones, thanks to our new partnership with Optiemus. Click the link in our bio to learn more about the new smartphone licensing deal, in which nearly 1.5 billion people in India, Sri Lanka, Nepal, and Bangladesh -- many of whom have never had a smartphone before -- will soon have access to BlackBerry handsets.",2017-02-06T20:44:05.000Z
na,1852,image,19,https://www.instagram.com/p/BQRMJ3IDEB0/?taken-by=blackberry,"has taken another major step in our ongoing software pivot with the release of the Software Development Kit (SDK) for BBM Enterprise. The secure, hosted cloud service allows developers to easily provide secure messaging, voice, and video in mobile communications. Developers can tap into BlackBerry’s vaunted global communications infrastructure and integrate everything that makes BBM Enterprise so secure into their own apps. To read the full story, click the link in our bio.",2017-02-08T23:11:51.000Z
11324,1860,video,27,https://www.instagram.com/p/BQdvLeBBgwC/?taken-by=blackberry,"BlackBerry is a mobile-native security software and services company dedicated to securing the Enterprise of Things.  From Unified Endpoint Management to secure communications and collaboration, BlackBerry software provides the embedded intelligence to secure the Enterprise of Things so that the Internet of Things can thrive. To see the full video, click the link in our bio.",2017-02-13T20:08:47.000Z
na,2186,image,23,https://www.instagram.com/p/BQi5cM6h6qr/?taken-by=blackberry,"Imagine your internet being so slow that it hinders your ability to get anything done. Pretty annoying, right?  This is exactly what happened to an unsuspecting university when hackers took control of over 5,000 IoT devices, such as vending machines, light sensors, and refrigerators. Curious to know how hackers could crash the university’s network using such everyday objects? Click the link in our bio to read the full story!",2017-02-15T20:14:39.000Z
na,2158,image,15,https://www.instagram.com/p/BQoORP1lS8-/?taken-by=blackberry,"Everyone has a story about how they developed the password they use every day -- and many of them relate to a favorite sports team. If you're using the hometown team as the basis for your password, it could make you and your company especially vulnerable to hackers. Start using a random password generator to help to make your passwords more secure! #BBSecurityTips",2017-02-17T21:52:52.000Z
na,3488,image,51,https://www.instagram.com/p/BNhrISNj5XH/?taken-by=blackberry,"Long passwords are annoying to remember and even more annoying to punch in every time your phone locks. DTEK60’s superb fingerprint sensor works with BlackBerry’s Password Keeper app. With DTEK60 and Password Keeper, you can login into your favorite apps and websites with just a touch of your finger. For more information on the DTEK60 fingerprint sensor, click the link in our bio. #TeamBlackBerry #DTEK60 shot by @blackberry_russia",2016-12-02T19:16:11.000Z
na,1788,image,12,https://www.instagram.com/p/BNplAe2DebV/?taken-by=blackberry,"Pivoting our business from devices to enterprise software is gaining notice – and praise. IT Business Edge analyst Rob Enderle wrote, “BlackBerry [is] working aggressively to change its image, which is allowing it to showcase far more success than its predecessors. Since every company will need to pivot, not just once but multiple times, over the course of its life in order to survive, watching and learning from BlackBerry is not only important if you need its solution but important because, eventually, you may want to emulate and improve on its process.” To read the full story click the link in our bio. #TeamBlackBerry #SoftwareIsTheNewBlackBerry",2016-12-05T20:56:36.000Z
6719,1161,video,24,https://www.instagram.com/p/BNz7lLYjZsP/?taken-by=blackberry,"As part of BlackBerry Secure – the foundation of our new enterprise software platform – we’ve constructed a set of powerful apps designed to integrate seamlessly with Microsoft Exchange, Skype for Business, and your business’s other solutions. These built-for-enterprise apps work together to streamline mobile collaboration so work can be completed anytime and anywhere — securely and all from one place. For more information, be sure to click the link in our bio #TeamBlackBerry #LSeries #SoftwareIsTheNewBlackBerry",2016-12-09T21:26:16.000Z
na,1333,image,14,https://www.instagram.com/p/BN7r15rDbyq/?taken-by=blackberry,"“BlackBerry’s mobile-security software business is built on the strength of its data encryption, which makes it harder to hackers to breach. The company has previously struck partnerships with companies ranging from Microsoft Corp., Salesforce.com Inc. and Samsung Electronics Co. to boost the security of their cloud-based platforms.  BlackBerry generated $494 million in software and services revenue last fiscal year, nearly double what it made in its 2015 fiscal year.” – David George-Cosh, Wall Street Journal#TeamBlackBerry #SoftwareIsTheNewBlackBerry",2016-12-12T21:42:40.000Z
na,3518,image,103,https://www.instagram.com/p/BOGN7eijrBs/?taken-by=blackberry,"Rumors to the contrary, BlackBerry still has strong wings. Learn the facts about why our software pivot is great news. 1. BlackBerry devices aren’t going away; 2. BlackBerry’s Android is better than ever; 3. we will still support BB10; 4. our software is the way to go for productivity; 5. security and reliability are what we do best. To read the full story click the link in our bio. Shot by @danielberlin87 #TeamBlackBerry #SoftwareIsTheNewBlackBerry",2016-12-16T23:52:55.000Z
na,1804,image,19,https://www.instagram.com/p/BOPuZkYjAnf/?taken-by=blackberry,"If you don’t want to see sad faces this holiday season, be extra careful when buying gifts online. Sometimes deals that seem “too good to be true” are exactly that, because they are phishing scams that allow thieves to steal your personal information. If you’re purchasing online, make sure you’re buying from a retailer’s legitimate site, not a cloned version set out to take advantage of you. #TeamBlackBerry",2016-12-20T16:29:49.000Z
na,2017,image,21,https://www.instagram.com/p/BOVF_a4h_eL/?taken-by=blackberry,"Canadian Prime Minister Justin Trudeau approves of what’s coming down the road for BlackBerry QNX. On December 19th, Prime Minister Trudeau announced the BlackBerry QNX Autonomous Vehicle Innovation Centre. The BlackBerry QNX Autonomous Vehicle Innovation Centre (AVIC) was created to advance technology innovation for connected and autonomous vehicles, independently as well as in collaboration with private and public sector organizations and research institutes. #TeamBlackBerry #QNX",2016-12-22T18:32:10.000Z
na,3053,image,35,https://www.instagram.com/p/BOdfpksDbOk/?taken-by=blackberry,"From all of us here at BlackBerry, happy holidays! #TeamBlackBerry",2016-12-26T00:50:18.000Z
na,2715,image,43,https://www.instagram.com/p/BOvEZb_hV_5/?taken-by=blackberry,Happy New Year! #SoftwareIsTheNewBlackBerry,2017-01-01T20:38:30.000Z
na,3079,image,21,https://www.instagram.com/p/BO77NcqB6X_/?taken-by=blackberry,"Connected and autonomous cars are the most exciting developments in the automotive industry, and BlackBerry’s end-to-end platform is driving functionality and security in these amazing new machines. Check out this stunning digital instrument panel and infotainment system running on the same chip in this Jaguar XJ, one of the concept cars we’re showing at CES this week. Learn more about how we’re innovating in automobiles: If you’re at CES in Las Vegas, be sure to visit our QNX team’s booth. For everyone else, be sure to click the link in our bio to see what QNX is rolling out at CES 2017. #TeamBlackBerry #QNX #CES2017",2017-01-06T20:28:20.000Z
na,2214,image,10,https://www.instagram.com/p/BPDlIfNh35m/?taken-by=blackberry,"If you want to know where automobile innovations are heading, check out QNX Software Development Platform (SDP) 7.0, which we unveiled last week at CES 2017. QNX SDP 7.0 enables automakers to consolidate infotainment, telematics, and digital instrument clusters, while also guarding against system malfunctions, malware, and cyberattacks. Take a look at the two QNX SDP 7.0-equipped concept cars we showcased at CES -- a Jaguar XJ and an autonomous Lincoln MKZ – as well as a 2017 Aston Martin Vanquish model, now shipping with our latest in-vehicle infotainment software technology, by clicking the link in our bio. #TeamBlackBerry #CES2017",2017-01-09T19:49:21.000Z
na,7213,image,214,https://www.instagram.com/p/BPIsyT5BZ7f/?taken-by=blackberry,"Check out why Mercury, the last smartphone designed by BlackBerry, won multiple “Best of CES” awards. Our hardware partner TCL will be bringing Mercury to markets around the world. Click the link in our bio for more info. #TeamBlackBerry #SoftwareIsTheNewBlackBerry",2017-01-11T19:32:26.000Z
na,2722,image,23,https://www.instagram.com/p/BMPd7Fjj_er/?taken-by=blackberry,"BlackBerry’s QNX Software puts the “smart in the car” in 60 million autos. No wonder Time Magazine calls BlackBerry the “tech company that is to connected cars what Microsoft is to PCs.” We’re proud to announce a new partnership with Ford, which already uses QNX for the Sync 3 infotainment system shown below, and looks to have fleets of self-driving cars on the road within the next five years. 😎 For more information be sure to click the link in our bio! #TeamBlackBerry #QNX #Ford",2016-10-31T21:03:03.000Z
na,3247,image,24,https://www.instagram.com/p/BMUVV73jA-7/?taken-by=blackberry,"Fun fact: the new Ford F-150 is built on 150 million lines of code. All that code potentially brings greater security risks, so Ford has partnered with BlackBerry’s QNX software and security platform to secure the connected vehicles of the future. For more information, click the link in our bio. Photo by @ramansuppal #TeamBlackBerry #SecuredCar #QNX #Ford",2016-11-02T18:24:17.000Z
na,2633,image,27,https://www.instagram.com/p/BMZpHd5jIKn/?taken-by=blackberry,"You’ve heard of self-driving cars…how about self-flying drones? The Ehang 184 personal drone can fly one passenger at a top speed of 100 kilometers/hour for 23 minutes. Could BlackBerry’s QNX software platform, which is helping carmakers like Ford Motor Company bring autonomous vehicles to the masses, have a future in autonomous aircraft, too? 🤔. For more information, click the link in our bio. #TeamBlackBerry #QNX",2016-11-04T19:53:16.000Z
na,2655,image,24,https://www.instagram.com/p/BMhZfhRjd4Q/?taken-by=blackberry,"Even if you don’t own a BlackBerry device, you interact with BlackBerry on a daily basis. QNX, our real-time operating system, helps keep jets aloft, lets you make hands-free calls, keeps you cool at a store’s checkout, and much more. Check out 32 other ways you encounter QNX every day, in the link to our infographic in our bio. #TeamBlackBerry #QNX",2016-11-07T20:10:40.000Z
na,3583,image,70,https://www.instagram.com/p/BMmzDLaj95c/?taken-by=blackberry,"The DTEK60 has been receiving glowing reviews from the media. Check out the latest review by ZDNet who says: “For $499, I can recommend the DTEK60 just based on its specifications alone. Add in the BlackBerry software, BlackBerry commitment and track record of fast security updates, and compelling dual glass and metal frame hardware design and it’s easy to see why the BlackBerry DTEK60 is a winner.” To see the full story, click the link in our bio #TeamBlackBerry #DTEK60",2016-11-09T22:30:12.000Z
na,2145,image,11,https://www.instagram.com/p/BMsAopsDQ-v/?taken-by=blackberry,"The next time you need to collaborate on a project or group activity, try Folia! Our partner Branchfire created it to help users share and edit documents flawlessly from any mobile device. Unlike some collaboration platforms, the Folia app was designed for mobile-first, optimizing the viewing and editing of documents in their native formats whether you’re on smartphone or tablet. For more information, click the link in our bio. #TeamBlackBerry #Folia",2016-11-11T23:05:06.000Z
na,2750,image,19,https://www.instagram.com/p/BMzo3HfDZjV/?taken-by=blackberry,"Cyberattacks by nation states and bad actors may set off the world’s next major war, putting military satellites, power grids, and economic security at more risk than ever before. Cybersecurity software is critical to defend government infrastructure and assets against these types of attacks. To learn more, click the link in our bio. #TeamBlackBerry #BBSecurity #GovTrusted",2016-11-14T22:11:18.000Z
na,6264,image,109,https://www.instagram.com/p/BM4e6f9DueN/?taken-by=blackberry,"Our DTEK60 is still getting glowing reviews from the media for its sleek design, top-notch security, and incredible 21 MP Camera. And now that our Android-based smartphones -- including DTEK60 -- are available in India, more of our fans around the world can find out why! For more information, click the link in our bio. 📸 by @tlq_tuan #TeamBlackBerry #DTEK60",2016-11-16T19:20:35.000Z
na,1906,image,33,https://www.instagram.com/p/BM9mdRWjRBP/?taken-by=blackberry,"Canada’s Smartest Person works for BlackBerry! Katy Warren is a hardware engineer for our BlackBerry Radar Solution, a device that provides trucking and transportation companies with real-time information about the cargo in their trailers and shipping containers. To learn why Katy is Canada’s Smartest Person, and what she thinks about working at BlackBerry, click the link in our bio! #TeamBlackBerry",2016-11-18T19:02:42.000Z
na,4397,image,256,https://www.instagram.com/p/BNFZBt_Dd5J/?taken-by=blackberry,"Once upon a time, BlackBerry was a giant in the land of smart phones. We invented much of what the smart phone is today and we built one of the world’s most globally recognized brands. But more than that, we developed a strong emotional connection with our customers that persists even today. You love us. 
But the market changed. Apple introduced the iPhone. Google brought Android to market. Suddenly competition was everywhere and moving fast. We weren’t fast enough. We lost our grip and fell behind. But all the while we continued to innovate in connected security and mobility, especially in software rather than hardware. 
That’s when our board brought in a new CEO. John Chen joined us as our leader in 2013 after a very successful stint turning around Sybase. He recognized our legacy and believed that BlackBerry could be a leader again, but this time by taking advantage of our software, security and mobility assets and phasing out the in-house manufacturing, distribution and marketing of handsets. And we are nearly there. In addition to our new leadership and the focus on software, we are also blessed with the market conditions to win. The time is right for BlackBerry to be a leader again. #SoftwareIsTheNewBlackBerry #TeamBlackBerry",2016-11-21T19:39:16.000Z
na,5219,image,126,https://www.instagram.com/p/BNKevf4jwQk/?taken-by=blackberry,"Are you looking for the perfect gifts to give this holiday season? Take advantage of our Black Friday sale, going on now on ShopBlackBerry, and take up to 55% off your order! Click the link in our bio to start stocking up on your favorite BlackBerry gear. 📸@latinblackberry #TeamBlackBerry",2016-11-23T19:05:24.000Z
na,2705,image,32,https://www.instagram.com/p/BNXgOE1DK0c/?taken-by=blackberry,"We’re proud to announce that BlackBerry is the first major mobile vendor to achieve the UK government’s new Cyber Essentials Plus (CE+) cybersecurity certification. We’re also an accredited CE+ certifying body and can help businesses obtain their own Cyber Essentials certification, a requirement for UK government contractors. With over 80 certifications and validations, BlackBerry continues to widen the gap as the world’s most trusted and secure mobile software platform. For more on the CE+ certification, click the link in our bio! #SoftwareIsTheNewBlackBerry #TeamBlackBerry",2016-11-28T20:28:27.000Z
na,2201,image,32,https://www.instagram.com/p/BK6Y07jjDBc/?taken-by=blackberry,Worried about holes in your current mobile security solution? Make the switch to BlackBerry EMM software! #Gartner just ranked us #1 in all 6 use cases for high security mobility management. #BBSecure #TeamBlackBerry 📸 taken by BlackBerry’s Mitch Mylius,2016-09-28T20:03:05.000Z
na,4644,image,190,https://www.instagram.com/p/BK_q3khjDCE/?taken-by=blackberry,"No need to worry: these are definitely NOT the last BlackBerry-branded phones you’ll see. The only difference is that instead of developing new handsets in-house, we’ll be licensing our much-loved smartphone software to trusted companies to make new BlackBerry devices. For more information, click the link in our bio. #TeamBlackBerry",2016-09-30T21:16:56.000Z
na,3164,image,67,https://www.instagram.com/p/BLHQHQCjVTB/?taken-by=blackberry,"“BlackBerry is no longer just about the smartphone, but the smart in the phone. That means that we will be focused on developing and licensing our secure device software and the BlackBerry brand… [allowing] us to leverage our core strengths to provide secure, connected, and inherently mobile solutions. It also allows us to … [bring] BlackBerry security and productivity applications to a wider audience across multiple platforms and devices.” To learn what this means for the next generation of BlackBerry-branded smartphones, read the full article by John Chen - just click the link in our bio!. #TeamBlackBerry",2016-10-03T19:57:04.000Z
na,2164,image,15,https://www.instagram.com/p/BLMRZINDq8s/?taken-by=blackberry,"A major Canadian cross-border trucking company has deployed BlackBerry Radar, an Internet of Things device that tracks fleets from anywhere in the world. The device collects real-time data on a shipment trailer’s location, route, interior temperature and humidity, and whether a trailer is loaded or empty or its doors open or closed. The data collected by Radar helps transportation companies ship faster and save money by preventing damaged or spoiled shipments or theft. To see the full story, click the link in our bio. #TeamBlackBerry #BlackBerryRadar",2016-10-05T18:44:27.000Z
na,1960,image,18,https://www.instagram.com/p/BLRV_KLDYXI/?taken-by=blackberry,"How did you get to work today? Our intern Mitch rode his bike to our office in San Ramon, California. Shot captured by Mitch using his #BlackBerryPassport #TeamBlackBerry",2016-10-07T18:00:48.000Z
na,1828,image,10,https://www.instagram.com/p/BLeMBUAjDEs/?taken-by=blackberry,"Beware of phishermen … pun intended. Just like a fisherman baits a line in hopes of luring a curious fish to take a bite, a phisherman tries to capture your personal data by sending you a message through social channels with a link to a cloned website. Victims who click the link and enter information on the fake website give hackers the opportunity to steal their passwords, usernames, banking info, credit card numbers, and more. To learn how to protect yourself from phishing, click the link in our bio. #TeamBlackBerry",2016-10-12T17:43:50.000Z
na,1713,image,17,https://www.instagram.com/p/BLjm-WWjyaO/?taken-by=blackberry,"Let Hub+ help you plan epic fun weekends! Hub+ consolidates all your social media feeds on one screen, making it easier to communicate with your friends across different channels, on any Android 5.x or 6x device! To learn more, click the link in our bio. #TeamBlackBerry",2016-10-14T20:15:34.000Z
na,2320,image,24,https://www.instagram.com/p/BLrUV00Dppn/?taken-by=blackberry,"“BlackBerry’s decision to license software and outsource handset production globally represents a win for the Canadian company’s biggest market, Indonesia.” – The Wall Street Journal, Oct. 16, 2016",2016-10-17T20:06:40.000Z
na,3318,image,49,https://www.instagram.com/p/BLwwuPUDUst/?taken-by=blackberry,I spy 👀 BlackBerry in the Wall Street Journal. You’ll also see print and online ads in the Financial Times touting our software shift. #TeamBlackBerry #WallStreetJournal,2016-10-19T22:50:52.000Z
na,2401,image,13,https://www.instagram.com/p/BL1020LjVNV/?taken-by=blackberry,"Looking at the same walls of your desk cubicle can get pretty old. Good Access and Good Work software both work cross-platform across smartphones and laptops, allowing you to make any destination your office. For more information click the link in our bio. #TeamBlackBerry #BBsecure",2016-10-21T22:03:12.000Z
na,6996,image,294,https://www.instagram.com/p/BL_cqFQj_b3/?taken-by=blackberry,"Treat yourself or your employees to our stunning new secure Android smartphone, DTEK60. It boasts a 21MP rear camera (and 8 MP front selfie cam), a stunning 5.5-inch scratch-and-smudge resistant Quad HD display, 3,000 mAh battery (for 24 hours of mixed use), a fingerprint sensor, and, of course, productivity and security software such as BlackBerry Hub, DTEK and more. Until Nov. 8, get free accessories if you buy DTEK60 at ShopBlackBerry.com. For more information click the link in our bio!",2016-10-25T15:44:09.000Z
na,2560,image,54,https://www.instagram.com/p/BME-UAYjT-_/?taken-by=blackberry,Pick up a real treat this Halloween with a new DTEK60 in your bag! The DTEK60 has fantastic specs and an even better price of $499 USD to back it up. See what people are saying about our newest smartphone! Link is in our bio. #TeamBlackBerry #DTEK60,2016-10-27T19:14:26.000Z
na,1829,image,23,https://www.instagram.com/p/BJx_edPDomC/?taken-by=blackberry,"Do you ever get a little uncomfortable when you feel someone looking at your phone as you’re writing a text or email? People can still ‘look over your shoulder’ when you’re sending messages or on a call. SecuSUITE, built for and trusted by the German government, helps protect you from third-party attacks by keeping all of your messages and calls encrypted! #TeamBlackBerry #GovTrusted",2016-08-31T17:16:14.000Z
na,3539,image,69,https://www.instagram.com/p/BJ0qnVXjyTf/?taken-by=blackberry,Congratulations to @jaimecation for winning this month’s #BBFOTM 😊 Be sure to keep posting creative photos of yourself with your BlackBerry - or taken with your BlackBerry - and use #BBFOTM for a chance to win next month! #TeamBlackBerry,2016-09-01T18:11:40.000Z
na,1988,image,16,https://www.instagram.com/p/BJ3GciUjjKS/?taken-by=blackberry,"Kiss this week goodbye; you made it to the weekend! Everyone in the U.S. and Canada, have a great Labor Day weekend. Don’t forget to tag us in your best photos shot with or featuring your #BlackBerry device (or software!) for a chance to be featured on our page! #TeamBlackBerry",2016-09-02T16:53:21.000Z
na,2086,image,12,https://www.instagram.com/p/BKEB84YjBIR/?taken-by=blackberry,"Driving can be stressful so #QNX brilliantly combines infotainment, safety, and security into one clean system to help connect drivers to their surroundings. Below is a #Jeep #Wrangler prototype with a cluster display and infotainment system built on QNX software. #TeamBlackBerry #BBSecurity",2016-09-07T17:24:12.000Z
na,2423,image,34,https://www.instagram.com/p/BKJWqXODzLN/?taken-by=blackberry,"Huge shout out to all of our fans for helping us reach 150,000 followers! #TeamBlackBerry",2016-09-09T19:01:22.000Z
na,2434,image,36,https://www.instagram.com/p/BKRUNrtDsUS/?taken-by=blackberry,Your house could be a mess but your phone doesn’t have to be! Download Hub+ today from the Google Play store to help keep you organized and boost your productivity. Available for most non-BlackBerry Android L (5.0) smartphones and above. #TeamBlackBerry,2016-09-12T21:13:54.000Z
na,1958,image,13,https://www.instagram.com/p/BKWI_DgjEPr/?taken-by=blackberry,software stands above our competition in six areas of Gartner’s Critical Capabilities for High-Security Mobility Management Report! Gartner is an American research firm known for its highly-respected analyses of the tech market. Get a copy of the report by clicking on the link in our bio. #BBSecurity #GovTrusted #TeamBlackBerry,2016-09-14T18:12:00.000Z
na,1601,image,8,https://www.instagram.com/p/BKbqDujjKZH/?taken-by=blackberry,"Former Secretary of State Colin Powell’s email hack has politicians scrambling to protect themselves against attacks. Some have even gone as far as deleting their Gmail accounts or switching back to flip phones. There's a much less drastic option: New York Times suggests that they adopt solutions used by Hollywood, another industry that counts on secure file transmission. With 5/6 of Hollywood's largest studios already trusting WatchDox to protect their movie scripts, why shouldn’t the government? For more on the story, click the link in our bio. #BBSecurity #TeamBlackBerry",2016-09-16T21:37:11.000Z
na,1613,image,12,https://www.instagram.com/p/BKjjiJbDs-J/?taken-by=blackberry,"30 years later and this is what the area around the Chernobyl nuclear disaster still looks like. Your organization may not have to face such large-scale potential emergencies. But AtHoc software has your back. AtHoc not only makes crisis communications easier, but it can alert you in real-time to potential threats gathered from sensor data (such as network-connected smoke alarms, for instance). This can help you avert disasters and reduce the scale of crises. #TeamBlackBerry #GovTrusted",2016-09-19T23:14:06.000Z
na,2703,image,70,https://www.instagram.com/p/BKokaVBj2VE/?taken-by=blackberry,We are growing into something bigger. SOFTWARE is the new BlackBerry. #TeamBlackBerry,2016-09-21T21:57:59.000Z
