views,likes,media,comments,url,caption,post_datetime
na,57425,image,"1,134",https://www.instagram.com/p/BLJ6MwODnHP/?taken-by=google,"Today we introduced a new family of devices #madebygoogle, including the new #Pixel phone. Find out more in our story or the link in our profile. 🎉",2016-10-04T20:43:18.000Z
56073,11598,video,110,https://www.instagram.com/p/BLMKJJ1DHQg/?taken-by=google,"¡Feliz Hispanic Heritage Month! 🎥 by @RDVious, a visual designer at Google who's also part of HOLA, the Hispanic Googlers Network. Over the next few days, we'll be sharing stories from our familia of HOLA Googlers and how they support the Latino community both inside and outside of Google. Stay tuned!",2016-10-05T17:41:06.000Z
na,23168,image,201,https://www.instagram.com/p/BLMt9tnDOFi/?taken-by=google,#ItTakesATeacher to prepare the leaders of tomorrow. Celebrate them on #WorldTeachersDay by sharing a story about your favorite teacher or what teachers mean to you. g.co/ItTakesATeacher,2016-10-05T22:54:07.000Z
na,29842,image,113,https://www.instagram.com/p/BLO0Rr1junb/?taken-by=google,"From improving cancer diagnosis tools to keeping farms alive, the 2016 #GoogleScienceFair finalists blew us away with their world-changing projects (and jumping skills). Meet them all ➡️googlesciencefair.com",2016-10-06T18:27:45.000Z
na,23837,image,232,https://www.instagram.com/p/BJjT5ZdDI8X/?taken-by=google,"“I feel like I’m 8 years old.” At 94, Betty Reid Soskin, the oldest park ranger in service, watches the night sky at Bryce Canyon in 360 inside the #HiddenWorlds of the National Parks with Cardboard. g.co/NationalParksVR #NPS100",2016-08-26T00:26:04.000Z
na,22665,image,295,https://www.instagram.com/p/BJlD8QLjtFd/?taken-by=google,"We’re a dog company. Happy #NationalDogDay from our “Dooglers”! This is Mack, our Cambridge office guard dog (and show-stealer on every office tour).",2016-08-26T16:45:08.000Z
43962,10111,video,230,https://www.instagram.com/p/BJlwWqfD0WW/?taken-by=google,Join Ranger Pegman on an adventure through sunken shipwrecks in the #HiddenWorlds of National Parks. 🐠 g.co/nationalparks #NPS100,2016-08-26T23:13:13.000Z
na,24034,image,334,https://www.instagram.com/p/BJn1FnSjOR9/?taken-by=google,"Today, the National Mall transformed into five National Parks with the help of #Cardboard and #HiddenWorlds (and some adventure-ready explorers!). #nps100mall",2016-08-27T18:33:04.000Z
48652,11022,video,183,https://www.instagram.com/p/BJtXH7OD_0F/?taken-by=google,Ranger Pegman is on a National Parks adventure soaring over the active Volcanoes of Hawaii. Discover this and more #HiddenWorlds → g.co/nationalparks,2016-08-29T22:06:41.000Z
43029,10857,video,114,https://www.instagram.com/p/BJwCm6NDhu6/?taken-by=google,Ride with Ranger Pegman through Bryce Canyon as you explore the #HiddenWorlds of the National Parks. 🗺 g.co/nationalparks.,2016-08-30T23:05:08.000Z
na,23406,image,331,https://www.instagram.com/p/BJxm-qcDFgS/?taken-by=google,Have you herd? 🐑  #StreetView is coming to the Faroe Islands thanks to the #SheepView project. Watch our Story and visit g.co/go/sheepview to learn more.,2016-08-31T13:42:11.000Z
53934,13114,video,226,https://www.instagram.com/p/BJx6MnEDHNF/?taken-by=google,"No matter how you spin it, your (Wi-Fi) signal is strong. Happy 1st birthday, OnHub! 🎂",2016-08-31T16:30:07.000Z
na,25261,image,521,https://www.instagram.com/p/BJ0gYjYDAQz/?taken-by=google,"Our new “G” made its debut one year ago today. Thank you for making it your own with #MySuperG creations from around the world, including this week’s stunner from @shaivalini.",2016-09-01T16:42:16.000Z
52342,10846,video,294,https://www.instagram.com/p/BJ3F-JgD33_/?taken-by=google,Grab your headlamp and join Ranger Pegman on an adventure through the Carlsbad Caverns to unearth the #HiddenWorlds of the National Parks. g.co/nationalparks,2016-09-02T16:49:12.000Z
118113,23206,video,508,https://www.instagram.com/p/BKBjPFLDdH_/?taken-by=google,We've got a new trick up our sleeve. You can now play solitaire on Google Search.,2016-09-06T18:17:19.000Z
na,35850,image,326,https://www.instagram.com/p/BKUAzxwD1d9/?taken-by=google,Today’s #MySuperG from @cargeekschmid takes us back to school. Tag your creative interpretation of our logo and we'll share our favorites.,2016-09-13T22:22:04.000Z
na,23600,image,16.2k,https://www.instagram.com/p/BI0dkQMjDy3/?taken-by=google,This shot from @lucialitman is the pineapple of our eye. 🍍 Play the 2016 #GoogleDoodle Fruit Games ➡️ g.co/fruit,2016-08-07T19:46:16.000Z
na,22720,image,21.7k,https://www.instagram.com/p/BI2uLOBjxnd/?taken-by=google,"This week's #MySuperG from @knailart nailed it, if we do say so ourselves. 💅 Tag yours and we'll share our favorites each week.",2016-08-08T16:49:52.000Z
79537,16519,video,14.7k,https://www.instagram.com/p/BI5PCNLjr08/?taken-by=google,"Searches for baseball, karate, skateboarding, surfing, and sports climbing get a boost after the Olympics announces five new sports for the 2020 games in Tokyo. #Olympics #GoogleTrends",2016-08-09T16:15:29.000Z
98208,20013,video,"5,365",https://www.instagram.com/p/BI-kVCyDjBh/?taken-by=google,The world flips out for gymnastics more than ever before. Searches are up 72% over the previous high in 2004. #GoogleTrends #Olympics #FinalFive,2016-08-11T17:57:45.000Z
99778,15885,video,"2,661",https://www.instagram.com/p/BJAxzj3jtiN/?taken-by=google,Your photo collection says “jump” and we say “how high?” Never run out of storage again with the free #GooglePhotos app for Android and iPhone. google.com/photos,2016-08-12T14:34:00.000Z
59530,14288,video,"1,090",https://www.instagram.com/p/BJDg24qDdiH/?taken-by=google,Search gets served. Searches for singles tennis bounce higher than ever before. #Olympics #GoogleTrends,2016-08-13T16:03:38.000Z
56349,15808,video,608,https://www.instagram.com/p/BJIwQHMjhe1/?taken-by=google,On your marks. Get set. Search! Running hurdles over searches for swimming and gymnastics as track and field events get underway. #Olympics #GoogleTrends,2016-08-15T16:54:21.000Z
65234,14518,video,841,https://www.instagram.com/p/BJLX0_Pjmto/?taken-by=google,"""Do you sweat when you swim?"" tops the list of fans’ questions. Yes you do. In the pool — and on the beach! #GoogleTrends",2016-08-16T17:18:39.000Z
65532,15027,video,453,https://www.instagram.com/p/BJTmoC0DAGZ/?taken-by=google,"Heading into the gold medal match, searches for Olympic soccer hit an all-time high. #GoogleTrends",2016-08-19T22:01:53.000Z
52884,16702,video,364,https://www.instagram.com/p/BJY6NVOjlIY/?taken-by=google,The world searched for the 2016 Rio Games more than any other Olympics in history. #ClosingCeremony #GoogleTrends,2016-08-21T23:29:12.000Z
67324,15288,video,415,https://www.instagram.com/p/BJdN9DWjHU4/?taken-by=google,"Meet Stanley, one of our #2016GoogleInterns hailing from Michigan. He once worked on a project to help Stephen Hawking better navigate his computer — and his spirit animal is a butterfly.",2016-08-23T15:38:42.000Z
56243,12902,video,208,https://www.instagram.com/p/BJiN7K2jNfo/?taken-by=google,"Join Ranger Pegman on an adventure to the #HiddenWorlds of the National Parks, starting with a kayak journey through glacial lagoons. 🗺 g.co/nationalparks",2016-08-25T14:14:39.000Z
na,26519,image,755,https://www.instagram.com/p/BIBCjahDM6G/?taken-by=google,This week’s #MySuperG from @kalippodesign is the bee’s knees. 🐝 Tag yours and we’ll share our favorites each week.,2016-07-18T20:28:57.000Z
na,20555,image,750,https://www.instagram.com/p/BIFqA4cjQyD/?taken-by=google,"Illustrators @marinaesmeraldo and @meaowree created a mural in Google Sheets, using cells as bricks. Here’s how their work went from Sheets to the streets of Brooklyn → g.co/sheets/art #madewithGoogleSheets #R29collabs (📷: @wes_tarca)",2016-07-20T15:30:43.000Z
na,17734,image,861,https://www.instagram.com/p/BIIG275jmxY/?taken-by=google,"Lisbon was a beautiful backdrop for our friends from across Europe who put #GooglePhotos through its paces last week, touring the city’s magnificent vistas and eating lots of custard tarts. Obrigado @amberrosephoto for the pic! #TBT",2016-07-21T14:21:15.000Z
45053,11049,video,808,https://www.instagram.com/p/BIKzqioD2b3/?taken-by=google,#EveryoneSpeaksFood paired #GoogleTranslate with cuisines from around the world in a pop-up restaurant in New York City. 🍣🌮🍝 Get a taste of how the experiment unfolded → g.co/go/everyonespeaksfood,2016-07-22T15:31:15.000Z
na,21577,image,"1,276",https://www.instagram.com/p/BILC3MkjVCT/?taken-by=google,"Four NBA stars are spending the day as Nooglers, getting an inside look at what it's like to work at Google. Grab your courtside seat on Snapchat: Google 🏀",2016-07-22T17:44:03.000Z
na,32326,image,"1,785",https://www.instagram.com/p/BIS6nT9DEDj/?taken-by=google,This week’s #MySuperG from @paper_magic_by_jr is a quilling masterpiece. 🌀✂️ Tag yours and we’ll continue to share our favorites each week.,2016-07-25T19:05:54.000Z
60561,15834,video,"1,081",https://www.instagram.com/p/BIaMoLYDEQB/?taken-by=google,"When the sun shines, we spin together. ☂🌀",2016-07-28T14:58:00.000Z
59188,13512,video,"1,426",https://www.instagram.com/p/BIc5-pljURq/?taken-by=google,"Meet Javier, one of our #2016GoogleInterns. His spirit animal is a Tanzanian chameleon and he’s danced with a professional ballet company in his home country of Colombia.",2016-07-29T16:12:46.000Z
59173,15281,video,"1,588",https://www.instagram.com/p/BInLjl-jFzg/?taken-by=google,Searches for the #Olympics are up 300% as athletes arrive in Rio and excitement is flying high. ✈️ #Rio2016 #GoogleTrends,2016-08-02T15:58:45.000Z
na,36920,image,"4,487",https://www.instagram.com/p/BIp2R1rDmyY/?taken-by=google,"Thanks for sharing your superb #MySuperG, @ahmaddoosti1!Tag yours and we’ll share our favorites.",2016-08-03T16:50:33.000Z
62571,16912,video,"2,507",https://www.instagram.com/p/BIviqlzDxq0/?taken-by=google,"With #Rio2016 upon us, searches for the Opening Ceremony are up 400%. #GoogleTrends",2016-08-05T21:54:37.000Z
na,19278,image,"4,411",https://www.instagram.com/p/BIx5JTyDrpG/?taken-by=google,A berry sweet shot by @tishacherry! 🍓🏅Play the 2016 #GoogleDoodle Fruit Games ➡️ g.co/fruit,2016-08-06T19:49:32.000Z
100278,15490,video,534,https://www.instagram.com/p/BHC5EPOj-ne/?taken-by=google,"👋🌈 We’re sending special #prideforeveryone Cardboard viewers around the world—giving people a way to celebrate #pride, no matter where they are. Watch the film in 360 degrees → g.co/prideforeveryone",2016-06-24T17:13:08.000Z
na,14355,image,455,https://www.instagram.com/p/BHDV-QBDfva/?taken-by=google,We asked Googlers to answer the question: What does #prideforeveryone mean to you? Here's one of their responses.,2016-06-24T21:25:44.000Z
na,25748,image,"1,517",https://www.instagram.com/p/BHFZ3z8D0Cn/?taken-by=google,"Pride weekend, here we come! #prideforeveryone",2016-06-25T16:38:17.000Z
65654,13787,video,603,https://www.instagram.com/p/BHID0oAD7OF/?taken-by=google,Be who you are. Love who you love. Experience Pride in 360 degrees → g.co/prideforeveryone #prideforeveryone,2016-06-26T17:23:20.000Z
na,21434,image,585,https://www.instagram.com/p/BHNAR3CDSR2/?taken-by=google,"Jigsaw puzzle party, anyone? This week's #MySuperG comes from @telemicroinformatica. Tag yours and we'll continue to share our favorites each week.",2016-06-28T15:28:34.000Z
na,18767,image,738,https://www.instagram.com/p/BHSKIMzjBvY/?taken-by=google,Psst...we've got a sweet surprise for Android fans on Snapchat. 👻: Google #AndroidNReveal,2016-06-30T15:30:50.000Z
na,44291,image,"1,462",https://www.instagram.com/p/BHSrfi0jCAF/?taken-by=google,"Welcome to the family, #AndroidNougat!",2016-06-30T20:22:23.000Z
na,46882,image,"5,258",https://www.instagram.com/p/BHZyVLpDuPX/?taken-by=google,This week’s tile-tastic #MySuperG from @aminnajafi7 is in a traditional Eslimi style. Tag yours and we’ll share our favorites each week.,2016-07-03T14:36:49.000Z
85257,16229,video,567,https://www.instagram.com/p/BHe0QfbjNdM/?taken-by=google,"Meet Colette, one of our #2016GoogleInterns in Mountain View. Her spirit animal is a dalmatian and her twin sister is interning at Google New York. 👯",2016-07-05T13:29:51.000Z
na,30557,image,"1,045",https://www.instagram.com/p/BHvVCWLD4Z6/?taken-by=google,This #MySuperG from @saeed.artworks is glowing in a few of our favorite colors. Tag yours and we’ll continue to share our favorites each week.,2016-07-11T23:24:08.000Z
na,25614,image,626,https://www.instagram.com/p/BHxQXm7DYLO/?taken-by=google,"Olá! This week’s #TourTuesday brings us to Google Brazil, where we’re getting in the Olympic spirit. #RioWithGoogle",2016-07-12T17:21:49.000Z
na,25334,image,843,https://www.instagram.com/p/BH9plQiDjDj/?taken-by=google,"Women are more than 💅 and 👸. This #WorldEmojiDay, we're celebrating with over 300 new emoji to help better represent the people who use them. g.co/go/emojiday",2016-07-17T12:53:02.000Z
na,25888,image,341,https://www.instagram.com/p/BGCSaOCQr1n/?taken-by=google,This week’s galaxy-inspired #MySuperG by @joey_bearbower is out of this world. ✨ Tag your DIY interpretation of our Super G and check out our favorites here each week.,2016-05-30T15:03:57.000Z
107471,21889,video,439,https://www.instagram.com/p/BGFNCniQrwB/?taken-by=google,"Hats off (or on) to the #2016GoogleInterns, who we’re welcoming to our offices worldwide this summer!",2016-05-31T18:14:46.000Z
59721,12389,video,255,https://www.instagram.com/p/BGJ7kJlwr7R/?taken-by=google,"To create today's #GoogleDoodle, a Doodler built her own camera rig and used thousands of pieces of paper to mimic the animation style of its subject, Lotte Reiniger. #NatAndLo went behind the scenes of how it was made:  g.co/go/NLlotte",2016-06-02T14:18:16.000Z
na,29894,image,557,https://www.instagram.com/p/BGMNYjhQr-N/?taken-by=google,You can’t spell “Google” without a few Os. Happy #NationalDonutDay! 🍩,2016-06-03T11:32:27.000Z
97198,18964,video,331,https://www.instagram.com/p/BGUq-WFQr3b/?taken-by=google,A World Tetris Day #MySuperG celebration from @GoogleUK? Score. Tag your DIY interpretation of our Super G and check out our favorites here each week.,2016-06-06T18:24:56.000Z
60175,12084,video,413,https://www.instagram.com/p/BGZ02qJQr4c/?taken-by=google,"On #WorldOceansDay, we’re asking the deep (sea) questions.",2016-06-08T18:27:28.000Z
na,14993,image,364,https://www.instagram.com/p/BGerhhSwr-h/?taken-by=google,Ben Franklin discovered the lightning rod on this day in 1752. But how fast do lightning bolts move? Here’s the answer in a flash. ⚡️,2016-06-10T15:42:09.000Z
na,26708,image,510,https://www.instagram.com/p/BGpBRaSQr7n/?taken-by=google,This week’s #MySuperG from @norayammine has us in stitches. Tag yours and we’ll continue to share our favorites each week.,2016-06-14T16:04:35.000Z
96984,17872,video,698,https://www.instagram.com/p/BGw-O07wr3p/?taken-by=google,"T(GIF). 🎉 #Gboard is now available in Canada, Australia, UK and Ireland. goo.gl/gboard",2016-06-17T18:11:57.000Z
na,22229,image,345,https://www.instagram.com/p/BG5Ff15Qr5U/?taken-by=google,We’re cereal-sly into this week’s #MySuperG from @lincoln2351. Tag yours and we’ll continue to share our favorites each week.,2016-06-20T21:49:22.000Z
na,28625,image,447,https://www.instagram.com/p/BG7KLXdQryr/?taken-by=google,Need some namaste on #InternationalYogaDay? Now you can search for your favorite yoga pose. #AndroidAdventures,2016-06-21T17:08:44.000Z
na,21419,image,493,https://www.instagram.com/p/BHBBpGOjfAh/?taken-by=google,Pride should know no boundaries. That's why we created #prideforeveryone—a virtual reality experience that brings Pride to those who cannot march. google.com/prideforeveryone,2016-06-23T23:49:36.000Z
na,29243,image,170,https://www.instagram.com/p/BFk0OA7wr8M/?taken-by=google,The sun has set on Day One of #io16. See you there tomorrow!,2016-05-19T04:22:10.000Z
na,27735,image,267,https://www.instagram.com/p/BFmReLFQr9Z/?taken-by=google,Welcome to #io16 Day 2! First stop: photo op. 📸,2016-05-19T17:57:01.000Z
73021,20037,video,182,https://www.instagram.com/p/BFmgvgJwr0E/?taken-by=google,Do the 🎨 robot #io16,2016-05-19T20:10:28.000Z
64914,16786,video,167,https://www.instagram.com/p/BFmsDZnQr9F/?taken-by=google,"Looks like a festival, acts like a conference. Headed in for a session at #io16.",2016-05-19T21:49:18.000Z
na,28362,image,302,https://www.instagram.com/p/BFm9c38wr-Z/?taken-by=google,A break between sessions. 💤 #io16 #androidadventures,2016-05-20T00:21:19.000Z
93925,15704,video,158,https://www.instagram.com/p/BFnTyBnwr54/?taken-by=google,What happens at #io16 After Hours... Goes on Instagram.,2016-05-20T03:36:27.000Z
na,26442,image,298,https://www.instagram.com/p/BFpHGBqwryB/?taken-by=google,Reflections on Day 3 of #io16.,2016-05-20T20:24:04.000Z
na,26296,image,256,https://www.instagram.com/p/BFrXAX2Qr0k/?taken-by=google,That's a wrap. Thanks to all who joined us at #io16 - see you next year!,2016-05-21T17:21:35.000Z
na,29503,image,324,https://www.instagram.com/p/BFwj-Zmwr-8/?taken-by=google,This week’s #MySuperG spotlight from @alessiodevecchi puts the “G” in CGI. Share yours and we’ll highlight our favorites here each week.,2016-05-23T17:51:07.000Z
na,25820,image,376,https://www.instagram.com/p/BF1rIOFwr3d/?taken-by=google,Explore Rio and its stadiums on #StreetView before the games begin. g.co/go/RioSV,2016-05-25T17:29:50.000Z
na,21592,image,386,https://www.instagram.com/p/BF7CDjtwrwC/?taken-by=google,"1.6 billion photo creations, 200 million users, and one birthday candle. Happy birthday, #GooglePhotos! 🎂",2016-05-27T19:26:22.000Z
na,16743,image,265,https://www.instagram.com/p/BF_sfOfwr_N/?taken-by=google,"Memorial Day weekend, Androidified.",2016-05-29T14:54:07.000Z
64153,11273,video,192,https://www.instagram.com/p/BErn3Twwr3x/?taken-by=google,"No matter what your primary color is, get to know your candidates better with #GoogleApp.",2016-04-26T23:17:30.000Z
60789,13389,video,421,https://www.instagram.com/p/BEvvh7Rwr7h/?taken-by=google,"No matter how you say it, we're wishing a very happy (and tasty) 10th birthday to #GoogleTranslate. #EveryoneSpeaksFood",2016-04-28T13:41:27.000Z
na,16346,image,474,https://www.instagram.com/p/BEy3znTQrzO/?taken-by=google,"#NatAndLo are getting Doodley. 🖌What questions should they ask the team that makes Google Doodles, aka Doodlers?",2016-04-29T18:51:30.000Z
na,24232,image,297,https://www.instagram.com/p/BE6endSwr8J/?taken-by=google,Help us reimagine our G with your own nuts and bolts. Tag your DIY version with #MySuperG and we'll share our favorites each week.,2016-05-02T17:45:18.000Z
63497,17067,video,265,https://www.instagram.com/p/BFEraLSQr7X/?taken-by=google,International Space Day? We're over the moon. 🌕,2016-05-06T16:49:29.000Z
na,20160,image,213,https://www.instagram.com/p/BFMndlLwr6g/?taken-by=google,@vladky94 solved these Rubik’s Cubes in style. Stay tuned for more of your awesome #MySuperG shots here each week (and keep your creations coming!). ⬜️,2016-05-09T18:48:56.000Z
na,15249,image,196,https://www.instagram.com/p/BFPDv-IQr0K/?taken-by=google,"Gazing Ball, meet Google. Take our Jeff Koons #KoonsLiveCase collaboration for a spin. 🔵  g.co/koons #KoonsXGoogle",2016-05-10T17:34:35.000Z
99848,16782,video,613,https://www.instagram.com/p/BFTuS2ewryr/?taken-by=google,"We’re feeling QWERTY. Gboard for iPhone puts Search, GIFs and more at your fingertips. goo.gl/gboard",2016-05-12T13:03:19.000Z
67419,17124,video,191,https://www.instagram.com/p/BFUFIzRQr-4/?taken-by=google,"Two wheels, no traffic (but safety first!). Happy #BikeToWorkDay! 🚲",2016-05-12T16:22:55.000Z
na,20972,image,197,https://www.instagram.com/p/BFWtqBXwr_t/?taken-by=google,The #DataCenterMurals Project brings the magic of data centers to the outside of their walls. 🎨  g.co/datacentermurals,2016-05-13T16:55:28.000Z
na,31279,image,393,https://www.instagram.com/p/BFeIj2Owrxr/?taken-by=google,@lucialitman's #MySuperG is farmer’s-market fresh. 🍓🍅 Share yours and we’ll highlight our favorites here each week.,2016-05-16T14:05:14.000Z
na,27362,image,232,https://www.instagram.com/p/BFjhweewry8/?taken-by=google,Welcome to #io16! Less than an hour before the keynote begins. Watch online at: google.com/io,2016-05-18T16:21:37.000Z
na,26088,image,206,https://www.instagram.com/p/BDV8Eb5Qr_Y/?taken-by=google,"We're caught red (and green, blue and yellow)-handed. Today's #GoogleDoodle celebrates Holi: g.co/go/holi2016",2016-03-24T16:39:22.000Z
na,18995,image,167,https://www.instagram.com/p/BDgXWDywr1u/?taken-by=google,It's game time. #MakerMonday #MySuperG,2016-03-28T17:50:07.000Z
52339,10206,video,253,https://www.instagram.com/p/BDlNU4Nwr2d/?taken-by=google,The #GoogleApp has a new voice. 🎙 Get to know her with Nat & Lo: g.co/go/NLVoice,2016-03-30T14:58:46.000Z
74299,14185,video,345,https://www.instagram.com/p/BDqj0M0Qryg/?taken-by=google,The future is clear. Meet Cardboard Plastic: google.com/cardboardplastic,2016-04-01T16:51:29.000Z
74410,11918,video,225,https://www.instagram.com/p/BDyaqrGQr0y/?taken-by=google,"Follow the primaries with the tap of your finger, trunk or hoof. 🇺🇸 #GoogleApp",2016-04-04T18:05:28.000Z
na,9878,image,126,https://www.instagram.com/p/BEJeYjXwr3r/?taken-by=google,"Can you guess the locations of these snaps from Terra Bella, Google's satellite startup? 🌎 Learn how they were taken in Nat & Lo's new episode: g.co/go/NLterrabella",2016-04-13T17:00:29.000Z
71262,13729,video,221,https://www.instagram.com/p/BEMIyUvQr8E/?taken-by=google,"Party in the front, party in the back. Say hello to #MyLiveCase for Nexus, where your case and your wallpaper meet. google.com/livecase",2016-04-14T17:49:29.000Z
na,17350,image,323,https://www.instagram.com/p/BEMrjMrwr87/?taken-by=google,"New Yorkers, stop by our Google Translate pop-up restaurant at Kenmare St. & Bowery St. for a sweet treat at our donut cart. 🍩 We'll be here today through Monday, from 3pm until they're gone! #EveryoneSpeaksFood",2016-04-14T22:53:15.000Z
na,16678,image,206,https://www.instagram.com/p/BEPNaEGwr7e/?taken-by=google,"On #WorldArtDay, these Androids are taking cues from the classics. 🖌",2016-04-15T22:27:35.000Z
68689,13951,video,214,https://www.instagram.com/p/BERcXfHwrwc/?taken-by=google,#NationalParkWeek is here! Explore parks across the country on #StreetView (backpack not required). 🌲g.co/go/NPW,2016-04-16T19:16:47.000Z
53293,12462,video,122,https://www.instagram.com/p/BEhBOLywr1b/?taken-by=google,Dioramas were great. But learning about the 🌍 with @GoogleMaps is way better → g.co/treks. #EarthDay,2016-04-22T20:27:26.000Z
na,15368,image,161,https://www.instagram.com/p/BErJMaFQr7_/?taken-by=google,Make it snappy. #AndroidWear snap-on MODE bands are here. g.co/wearmode #WearMODE,2016-04-26T18:49:30.000Z
na,17603,image,171,https://www.instagram.com/p/BCGWrUswr51/?taken-by=google,Beast mode. 🐲 #MakerMonday #MySuperG,2016-02-22T18:52:38.000Z
na,14511,image,176,https://www.instagram.com/p/BCI8fz2wr38/?taken-by=google,#HowCanWe make things better with science? Submit your brightest ideas to @googlesciencefair 2016. 🔬 www.googlesciencefair.com,2016-02-23T19:01:35.000Z
74110,15353,video,149,https://www.instagram.com/p/BCYYLbBQr_d/?taken-by=google,An extra day? We're walking on the wild side. 🗓 #LeapDay,2016-02-29T18:52:05.000Z
na,17910,image,123,https://www.instagram.com/p/BCgGB88wr8r/?taken-by=google,Go behind the paws of the Last Great Race on Earth. See the Iditarod on #StreetView. ❄️ g.co/go/iditarod (📷: @holmesphoto on assignment for @alaskadispatch),2016-03-03T18:47:26.000Z
82735,15673,video,274,https://www.instagram.com/p/BCrHJV-wr_8/?taken-by=google,"Starting tomorrow in Seoul, our #AlphaGo artificial intelligence competes against a legendary Go player. ⚫️⚪️ Ready, set... g.co/go/AlphaGo",2016-03-08T01:28:49.000Z
na,16832,image,738,https://www.instagram.com/p/BCr0X7CQr2H/?taken-by=google,How will your future self leave her mark on the world? Tell us in a comment with #OneDayIWill. g.co/IWD,2016-03-08T08:04:01.000Z
61630,13117,video,235,https://www.instagram.com/p/BCs-Ds0wr0B/?taken-by=google,"You dream of being infographists, drummers, social workers, moon-explorers, mermaids and more. Keep sharing your #OneDayIWill dreams and we'll keep doodling them. 💫 g.co/IWD",2016-03-08T18:47:53.000Z
na,16137,image,258,https://www.instagram.com/p/BCvun8MQrwz/?taken-by=google,Animal selfies are here! 🐘📷 See all of #GooglePhotos' snaps from @thelosangeleszoo: g.co/ZoogleSelfies,2016-03-09T20:30:45.000Z
67693,15725,video,223,https://www.instagram.com/p/BC8MAdAQr3w/?taken-by=google,"No matter how you slice it, 3/14 is a sweet one. Happy Pi Day!",2016-03-14T16:38:23.000Z
na,15123,image,197,https://www.instagram.com/p/BDDyGLtQr26/?taken-by=google,We're feeling lucky. 🍀 #AndroidAdventures,2016-03-17T15:25:54.000Z
na,19167,image,163,https://www.instagram.com/p/BDO15fSwr8O/?taken-by=google,Showing our stripes. #MakerMonday #MySuperG,2016-03-21T22:30:46.000Z
na,15573,image,253,https://www.instagram.com/p/BDRBfcKwr58/?taken-by=google,Congratulations to #Doodle4Google winner Akilah Johnson! 🖌 g.co/go/d4g2016,2016-03-22T18:50:33.000Z
na,30728,image,346,https://www.instagram.com/p/BAu4PM3Qrw7/?taken-by=google,"Greetings from our new Kitchener-Waterloo office in Canada, home to 400 engineers (and some nifty neon). 🇨🇦 #TourTuesday ",2016-01-19T19:32:43.000Z
53543,14585,video,163,https://www.instagram.com/p/BAzcG1iQr94/?taken-by=google,Ain't no mountain high enough to keep us from gettin' to you. Introducing #MontBlanc360: g.co/MontBlanc ❄️,2016-01-21T14:03:07.000Z
