views,likes,media,comments,url,caption,post_datetime
na,22224,image,313,https://www.instagram.com/p/BP-kkHgjS2I/?taken-by=google,"Throughout #BlackHistoryMonth, we'll be sharing profiles of Black Googlers and how they support the Black community both inside and outside of Google. Today, meet Tia. Not only is she leading efforts to create a more web-connected community in Raleigh and Durham, NC, but in her 20% time she is co-leading Google's #BlackHistoryMonth programming spanning 70+ events across US Google offices. Says Tia, ""It's more than just Black history, it's a collective history of Americans. Let's all learn and celebrate.""",2017-02-01T17:39:34.000Z
na,50212,image,259,https://www.instagram.com/p/BQLmafUjU4U/?taken-by=google,All buttoned up and ready to take on the week with this #MySuperG from @anuroopclicks.,2017-02-06T19:05:52.000Z
na,33319,image,152,https://www.instagram.com/p/BQOP9NpjSXw/?taken-by=google,"Goodbye Westeros, hello Greenland. Wearing a trusty Street View Trekker backpack, @nikolajwilliamcw helped capture the country's changing landscape for Google Maps. Check out his adventure in our story.",2017-02-07T19:47:21.000Z
na,34904,image,218,https://www.instagram.com/p/BQOgWeQDYup/?taken-by=google,"Say hello to Stella, a sleepy #Doogler from our Mountain View office. A consistently late riser, she's not the most punctual pooch. 😴",2017-02-07T22:10:36.000Z
na,19164,image,,https://www.instagram.com/p/BQQyE9AjRj9/?taken-by=google,"Meet Lynette. Lynette is a global co-chair of the Black Googler Network, which strives to foster success in the Black community at Google and beyond. In her day-to-day role, she leads a team dedicated to finding top talent for Google: ""I utilize my background to encourage my team to read between the lines, consider different angles, and lean in on a candidate's past impact to find them the right role at Google."" #BlackHistoryMonth",2017-02-08T19:23:59.000Z
114255,16980,video,412,https://www.instagram.com/p/BQQ-Aohjki-/?taken-by=google,"So many questions, so much VR. We're going behind the scenes of virtual reality at Google with #NatAndLo—what do you want to know? 🤔",2017-02-08T21:08:15.000Z
na,40904,image,200,https://www.instagram.com/p/BQTgLveDL9U/?taken-by=google,Is this real life? Because this #pixelperfect adventure into the blue caves of Iceland by @hotforsagan looks like a dream.,2017-02-09T20:45:21.000Z
na,26729,image,164,https://www.instagram.com/p/BQYWFhcDZwT/?taken-by=google,Shining bright at #LanternFestival as we mark the end of #LunarNewYear celebrations.,2017-02-11T17:53:19.000Z
na,38281,image,828,https://www.instagram.com/p/BO5FzGrj_BZ/?taken-by=google,"We want to see (and share!) your #pixelperfect photos. Each week we'll choose a new theme for you to capture with your Pixel. We're kicking off 2017 with a trip outdoors, like this beauty of Arches National Park from @therealblasiansensation. What are you seeing outside? Take a shot using your Pixel and tag #teampixel for a chance to be featured next week. Now get out there!",2017-01-05T18:03:08.000Z
na,34559,image,"1,138",https://www.instagram.com/p/BO8Vc-lDRhX/?taken-by=google,"To kick off #CES2017, we took some time to celebrate with the #madebygoogle family.",2017-01-07T00:17:39.000Z
na,37030,image,"5,288",https://www.instagram.com/p/BPDapgnDL09/?taken-by=google,Today's #MySuperG from @mahshad.shohrati reminds us to celebrate the sweet stuff. 🍭,2017-01-09T18:17:44.000Z
na,39236,image,"1,274",https://www.instagram.com/p/BPGTAs5D49k/?taken-by=google,"Last week we asked for a #pixelperfect shot of the outdoors, and @jsl.oz delivered with this Pixel photo of a frolic-worthy Tasmanian lavender farm.",2017-01-10T21:08:43.000Z
na,32697,image,752,https://www.instagram.com/p/BPIjqyMDutO/?taken-by=google,Pegman has arrived just in time to give an inside look at Hamburg's new #Elbphilharmonie concert hall.,2017-01-11T18:12:45.000Z
na,38320,image,324,https://www.instagram.com/p/BPLYnSEjV7M/?taken-by=google,Take your Pixel to new heights with this week's #teampixel theme: bird's-eye view. Thanks @pagejakob for inspiring us to take the stairs with this #pixelperfect shot.,2017-01-12T20:33:53.000Z
na,35195,image,343,https://www.instagram.com/p/BPNvwatjI-M/?taken-by=google,"Hands up for the weekend, #teampixel. 📷: @tanrr",2017-01-13T18:34:35.000Z
na,44051,image,901,https://www.instagram.com/p/BPQNSbSDGcW/?taken-by=google,"Unlike Harry and Draco, Gustave and Mieka never quarrel—but they're always up for a good game of #Doogler Quidditch. #DressUpYourPetDay",2017-01-14T17:31:07.000Z
na,18628,image,223,https://www.instagram.com/p/BPYOhcnDsCu/?taken-by=google,Last week we asked you to capture your world from a birds-eye view. @etrati's shot from the streets of Tehran is just our type of #pixelperfect.,2017-01-17T20:15:50.000Z
na,44978,image,315,https://www.instagram.com/p/BPalT7CDAyB/?taken-by=google,A mid-week pick-me-up brewed by @nadinem8. ☕️,2017-01-18T18:13:27.000Z
na,30737,image,300,https://www.instagram.com/p/BPdZI2HjdZg/?taken-by=google,"From fur to fins, get wild with this week's #teampixel theme: animals! For a chance to be featured on Tuesday, be sure to tag your photo with #teampixel. Thanks @selvino_fernandes for sharing this #pixelperfect aquatic pair. 🐟",2017-01-19T20:24:48.000Z
na,37309,image,288,https://www.instagram.com/p/BPnj1eDj2Sw/?taken-by=google,This week's #MySuperG from @Android is all kinds of sweet. 🍭,2017-01-23T19:10:40.000Z
na,33273,image,134,https://www.instagram.com/p/BOaNeI_DAwQ/?taken-by=google,We knew we heard jingle bells. #TrackSanta and his crew as they journey across the world → g.co/santatracker,2016-12-24T18:13:44.000Z
89156,15944,video,213,https://www.instagram.com/p/BOaZfE5juNa/?taken-by=google,New phone under the tree? Take the #GooglePhotos app for a spin and automatically get all the photos from your old phone onto your new one.,2016-12-24T19:58:43.000Z
92203,18573,video,274,https://www.instagram.com/p/BOfPbqzjAxF/?taken-by=google,A new year needle drop for #MySuperG. Tag your creative interpretation and we'll share our favorites!,2016-12-26T17:07:04.000Z
na,24534,image,227,https://www.instagram.com/p/BOh1P-xDPfY/?taken-by=google,"Meet Joey, a dapper #Doogler from our Mountain View office. When he isn't guarding his team like a champ, he enjoys snacking on 🍎and 🍉.",2016-12-27T17:16:00.000Z
198005,30685,video,"1,938",https://www.instagram.com/p/BOiId3gjXhi/?taken-by=google,"In 2016, the march toward equality took even more steps forward. LGBT was searched at an all-time high this year. #YearInSearch",2016-12-27T20:03:55.000Z
na,38029,image,282,https://www.instagram.com/p/BOkePTqDmPK/?taken-by=google,"Follow the footprints to serene, wintry bliss in Saskatchewan with @gwenvanmeter's #pixelperfect photo.",2016-12-28T17:52:39.000Z
na,22977,image,304,https://www.instagram.com/p/BOnGP_bjhfL/?taken-by=google,"Hot code-coa, anyone? We hear @madewithcode makes the best kind for those chilly winter days. ☕️",2016-12-29T18:20:45.000Z
128661,24280,video,618,https://www.instagram.com/p/BOpeMfMjoMv/?taken-by=google,That face! Those ears! Our love of 🐶 sent searches for puppy to an all-time high in search interest. #YearInSearch,2016-12-30T16:28:28.000Z
108847,36684,video,"2,047",https://www.instagram.com/p/BOsKnbOjuTh/?taken-by=google,"Ringing in the new year the best way - with smooth moves and confetti. Hello, 2017! 🎉",2016-12-31T17:35:07.000Z
196218,43098,video,"3,501",https://www.instagram.com/p/BOxWbnwDv1J/?taken-by=google,Here's to a year that blooms. #MySuperG,2017-01-02T17:54:34.000Z
na,60175,image,"3,046",https://www.instagram.com/p/BOz-dKpDiQJ/?taken-by=google,"New year, new #Doogler. Say hello to Zeus from our LA office, who can jump so high we're sure he has ⚡️in his paws.",2017-01-03T18:22:47.000Z
na,23932,image,926,https://www.instagram.com/p/BO2gM65D5e-/?taken-by=google,"""It is like creating art in your dreams."" –@bradleytheodore, one of 60+ artists in our #TiltBrush Artist in Residence program making immersive virtual reality art.",2017-01-04T17:56:08.000Z
110848,15172,video,830,https://www.instagram.com/p/BN-bOWcDXA2/?taken-by=google,"#prideforeveryone: this year we delivered Cardboard to LGBT organizations like the Fundacion Sergio Urrego in Colombia, to bring the experience of global pride parades to life.",2016-12-13T23:15:10.000Z
na,25830,image,185,https://www.instagram.com/p/BOAx2-4jVsy/?taken-by=google,"With an email subject line of ""Machine learning + data centers = awesome?"" Google engineer Jim Gao kicked off a new way for our data centers to run leaner and greener. Go behind the data, the story and where we're headed next → g.co/environment",2016-12-14T21:11:26.000Z
na,24551,image,102,https://www.instagram.com/p/BODMW2WjtPO/?taken-by=google,Rockin' around the Chromecast tree. 🎄,2016-12-15T19:41:28.000Z
127346,19375,video,326,https://www.instagram.com/p/BODZLhsDQ_x/?taken-by=google,"As 2016 draws to a close, let's take a look back through the moments that defined it. Watch the full #YearInSearch video at g.co/2016",2016-12-15T21:33:31.000Z
na,27520,image,172,https://www.instagram.com/p/BOGIurvDEt8/?taken-by=google,This #pixelsweater pop-up is knit. Visit us at 96 Spring Street in NYC through the 23rd to see what's pedaling.,2016-12-16T23:07:29.000Z
na,48258,image,243,https://www.instagram.com/p/BONO61QjQ-j/?taken-by=google,"An ornamental #MySuperG, fit for a holiday tree. Thanks, @nils_bakker! 🎄Tag your creative interpretation and we'll share our favorites.",2016-12-19T17:16:15.000Z
na,29531,image,318,https://www.instagram.com/p/BOP0FY-D_SB/?taken-by=google,"Lola and Brie from our Chicago office go together like Yin and Yang. This #Doogler duo can often be found looking at themselves in the mirror, basking in their cuteness.",2016-12-20T17:19:29.000Z
214182,25996,video,591,https://www.instagram.com/p/BOQHb8UjKCH/?taken-by=google,👏 when your favorite 90's dance move comes back in style. The Running Man was searched more in 2016 than ever before. #YearInSearch #RunningManChallenge,2016-12-20T20:08:36.000Z
na,19970,image,369,https://www.instagram.com/p/BOQUHEkDtKV/?taken-by=google,"Ugly vegetables? We don't carrot all. By using produce that wasn't considered pretty enough to sell, we helped our Bay Area cafés save over one million pounds of food waste in 2016. g.co/environment",2016-12-20T21:59:20.000Z
na,36916,image,302,https://www.instagram.com/p/BOShfyijI1T/?taken-by=google,Life's a little more colorful with Pixel. Share your photos with #teampixel and be part of something bigger. Thanks @imjustolly for starting the party with this #pixelperfect shot. 🎉,2016-12-21T18:34:47.000Z
157472,22744,video,209,https://www.instagram.com/p/BOVT5Uljv_9/?taken-by=google,"Hi Jupiter, it's us, 🌎. We got to meet Jupiter this year when NASA shared its first in-orbit view of the ""gas giant,"" sending the planet to a new all-time high in search interest. #YearInSearch",2016-12-22T20:33:40.000Z
78190,15722,video,124,https://www.instagram.com/p/BOX1J4qDFDX/?taken-by=google,"When the unthinkable happened, we relied on one another. Searches for blood donation hit an all-time high on the day of the Orlando shootings. #YearInSearch",2016-12-23T20:02:46.000Z
57998,13261,video,86,https://www.instagram.com/p/BNX3K_sjHIC/?taken-by=google,Shake it like a #MySuperG picture. Tag your creative interpretation of our logo and we'll share our favorites!,2016-11-28T23:49:00.000Z
na,26437,image,228,https://www.instagram.com/p/BNaM68Cj7kD/?taken-by=google,"Meet Enzo (right), a #Doogler at our Palo Alto office who loves hosting his pal Olive for campus tours (and striking a few poses).",2016-11-29T21:37:32.000Z
55384,13163,video,184,https://www.instagram.com/p/BNaYdU9DAiR/?taken-by=google,"Going, going... almost gone! K-12 artists, it's your last chance to enter the #Doodle4Google contest for a chance to be featured on the Google homepage. Link in bio. 🚀",2016-11-29T23:18:21.000Z
na,25509,image,194,https://www.instagram.com/p/BNpkGtTj4q7/?taken-by=google,Feeling the love from this #MySuperG by @art.zimm. Tag your interpretation of our logo and we'll share our favorites!,2016-12-05T20:48:43.000Z
120723,19767,video,216,https://www.instagram.com/p/BNsCSuNjjn0/?taken-by=google,Wi-Fi status = 💯. Say hello to Google Wifi. Link in bio.,2016-12-06T19:50:59.000Z
na,31711,image,273,https://www.instagram.com/p/BNuiCRBDAtT/?taken-by=google,"A Wednesday wink from Louie Cheesecake, the wet-nosed #Doogler.",2016-12-07T19:06:50.000Z
na,20081,image,52,https://www.instagram.com/p/BNxPEncjUMz/?taken-by=google,We stitched together thousands of photos to bring NYC's holiday windows to you. Your virtual walk through our #WindowWonderland starts in our story. ❄️,2016-12-08T20:18:51.000Z
na,30569,image,188,https://www.instagram.com/p/BNxaJtRj_Bc/?taken-by=google,"In 2012 we set a goal to run our company on 100% renewable energy. We'll reach it in 2017, a year ahead of schedule. Stay tuned for more stories about projects and people helping reduce impact on the environment. g.co/environment",2016-12-08T21:55:40.000Z
na,17298,image,139,https://www.instagram.com/p/BNzt-9BDS59/?taken-by=google,"Over 10 years ago, Google engineer Rebecca Moore used Google Earth to prevent the logging of 1,000 acres of redwood trees near her home in the Santa Cruz, CA mountains. Her project ultimately inspired the creation of Google Earth Engine, a satellite imagery platform which helps monitor global deforestation. → g.co/environment",2016-12-09T19:27:27.000Z
na,35911,image,165,https://www.instagram.com/p/BN7eC91DkqL/?taken-by=google,Color us impressed with this week's #MySuperG by @therevisionguide. ✍️ Tag your own creative interpretation and we'll share our favorites!,2016-12-12T19:42:07.000Z
na,33787,image,247,https://www.instagram.com/p/BN99gHdDAR6/?taken-by=google,"Today our self-driving 🚗 team hits the road on their own. World, meet #Waymo, a new way forward in mobility. www.waymo.com",2016-12-13T18:55:27.000Z
na,12445,image,95,https://www.instagram.com/p/BN-KZTzjjVF/?taken-by=google,"This pug is a jet-setter. Meet Jade, a travel-loving #Doogler from our Seattle office who loves to join her human on trips to different Google offices.",2016-12-13T20:48:07.000Z
na,25873,image,119,https://www.instagram.com/p/BMW1MXwDOz9/?taken-by=google,We had some fun on our Google Cardboard expedition to the #HiddenWorlds of the National Parks. g.co/nationalparks,2016-11-03T17:41:05.000Z
na,37898,image,209,https://www.instagram.com/p/BMhpV-Pj6zf/?taken-by=google,This week’s beautifully hand-drawn #MySuperG from @flowers_and_pebbles = notebook goals. 📒,2016-11-07T22:29:11.000Z
na,26475,image,122,https://www.instagram.com/p/BMj1cL6j32C/?taken-by=google,Show your friends you're stuck on voting. Share #IVoted stickers straight from #Gboard. goo.gl/gboard 🇺🇸✔️,2016-11-08T18:53:22.000Z
na,23053,image,183,https://www.instagram.com/p/BMkTMIcjMB4/?taken-by=google,"Hello from Roux, a Los Angeles #Doogler who made his way to the pawling place today. He's spending the rest of #ElectionDay at home listening to his favorite type of music: jazz. 🎶",2016-11-08T23:13:19.000Z
na,113329,image,506,https://www.instagram.com/p/BMpjQtCjSr3/?taken-by=google,#Daydream View is here. Immerse yourself in all the things you love. madeby.google.com/vr,2016-11-11T00:09:57.000Z
na,27774,image,187,https://www.instagram.com/p/BMr0h3Ej0_c/?taken-by=google,Make your Live Case pop with Jeremy Scott. Check out the whole crew and create your case: g.co/JeremyScott #JeremyScottxGoogle,2016-11-11T21:19:19.000Z
na,30674,image,674,https://www.instagram.com/p/BMzXukhDtHa/?taken-by=google,"For #transweek, we're celebrating the inspirational #transvoices building inclusive communities. https://goo.gl/uB096I",2016-11-14T19:41:35.000Z
na,29915,image,229,https://www.instagram.com/p/BM1yUJrjauZ/?taken-by=google,"A-tisket, A-tasket, a #Doogler in a basket. Penny Phrances Peterson hails from our Sunnyvale office, where she noshes on healthy snacks like mini-carrots and apple slices.",2016-11-15T18:12:23.000Z
103325,20684,video,135,https://www.instagram.com/p/BNFW1oYDTGs/?taken-by=google,A clayful take on #MySuperG from @e_known. Tag your own interpretation of our logo and we'll share our favorites each week!,2016-11-21T19:20:08.000Z
na,37245,image,415,https://www.instagram.com/p/BNH7_UDDvUO/?taken-by=google,"Say hello to Arthur, a New York City #Doogler and fan of fire trucks 🚒. A responsible pup, he never leaves the house without his Google badge.",2016-11-22T19:23:15.000Z
90716,15639,video,161,https://www.instagram.com/p/BNKaTDFDH3M/?taken-by=google,"Happy #ThanksScanning! This holiday, gobble up glare-free scans of old family photos with the PhotoScan app from Google Photos. 🦃 g.co/PhotoScan",2016-11-23T18:26:34.000Z
na,31471,image,251,https://www.instagram.com/p/BNMlnlpj0pg/?taken-by=google,"Save room for dessert, but don't eat your #Pixel (no matter how sweet it looks). 📷",2016-11-24T14:43:58.000Z
145588,23583,video,452,https://www.instagram.com/p/BL_iHvujsAv/?taken-by=google,Nothing like unboxing a brand new #Pixel.,2016-10-25T16:31:53.000Z
na,31258,image,162,https://www.instagram.com/p/BL_-Do9Dgc4/?taken-by=google,"Say hello to Chloe and Zoe, a #Doogler duo from our Chicago office. Despite their regal stature, they are quite afraid of Yorkies.",2016-10-25T20:36:00.000Z
na,21315,image,119,https://www.instagram.com/p/BMCxCrLDjQa/?taken-by=google,"From sandy beaches to stars in space, we've collaborated with a few of our favorite artists to design the Artworks #MyLiveCase collection. Shop now: g.co/livecase",2016-10-26T22:39:59.000Z
na,30678,image,315,https://www.instagram.com/p/BMHNqkkDfsU/?taken-by=google,"Food so perfectly tiny you might squeal. If you're in NYC, the @zagat #TinyCafe is popping up in Astor Place through Saturday.",2016-10-28T16:07:04.000Z
na,17746,image,93,https://www.instagram.com/p/BMHZWAjDZER/?taken-by=google,"Strange things are coming to #GoogleAllo. A #StrangerThings sticker pack, in fact — just in time for Halloween.",2016-10-28T17:49:07.000Z
na,30926,image,166,https://www.instagram.com/p/BMKKRBSjlxF/?taken-by=google,We’re feline lucky. 😺 Happy #NationalCatDay from our #madebygoogle space in NYC!,2016-10-29T19:35:05.000Z
na,23744,image,101,https://www.instagram.com/p/BMMQpnWD5Ol/?taken-by=google,"Where’s Barb? If you’re in NYC today, ask the Google Assistant in #GoogleAllo and unlock your powers. #StrangerThings",2016-10-30T15:09:21.000Z
55098,12319,video,63,https://www.instagram.com/p/BMPPoK-jzHB/?taken-by=google,From pirates to Pikachu and devils to dragons — conjure up Halloween's most popular costumes with #Frightgeist. g.co/frightgeist,2016-10-31T18:58:08.000Z
na,31239,image,101,https://www.instagram.com/p/BMRqPPxDGPs/?taken-by=google,"This week’s #MySuperG brought to you by our very own #NatAndLo, who used machine learning to apply their colorful style. Learn how: g.co/go/NLstyle",2016-11-01T17:29:09.000Z
na,19243,image,153,https://www.instagram.com/p/BMR_6YhjH5k/?taken-by=google,"Meet Charleton, a well-dressed #Doogler from our New York City office. He loves the goodies at Chelsea Market — which he eats with his charming underbite.",2016-11-01T20:38:32.000Z
na,29709,image,168,https://www.instagram.com/p/BMUUwcgj_Mj/?taken-by=google,Celebrating the Day of the Dead among a bed of marigolds. #VivoDiaDeMuertos,2016-11-02T18:19:10.000Z
na,27926,image,121,https://www.instagram.com/p/BMUliLwjO7G/?taken-by=google,#Code comes to life in unexpected ways. @MadewithCode joined the fun at the Grace Hopper Celebration of Women in Computing last month. #GHC16,2016-11-02T20:45:46.000Z
na,25687,image,207,https://www.instagram.com/p/BLRU1PKDpnJ/?taken-by=google,"Meet Alberto, a member of HOLA, our Hispanic Googlers Network. Alberto is a finance engineer, former DJ, and first-generation immigrant from Mexico who is passionate about creating diverse teams. When interviewing people for jobs at Google, he says: “I draw on my experience as a first-generation immigrant to help understand how different life experiences shape a candidate’s story.” #HispanicHeritageMonth",2016-10-07T17:50:42.000Z
na,39879,image,438,https://www.instagram.com/p/BLZHHxYjG5R/?taken-by=google,This week's beautiful #MySuperG by @jessillustrates has us in the mood for some fall leaf-peeping. 🍂 Tag yours and we’ll continue to share our favorites each week.,2016-10-10T18:24:49.000Z
na,33897,image,192,https://www.instagram.com/p/BLbtxyDjO7D/?taken-by=google,This golden retriever named Google (!) taught us a lot about pet photography at a #GooglePhotos workshop in our São Paulo office. It’s safe to say we’ve found our spirit animal. 🐶,2016-10-11T18:41:05.000Z
na,37472,image,259,https://www.instagram.com/p/BLeeVzpD7T8/?taken-by=google,"Meet Lucy. Born in Peru and raised in Athens, GA, she’s now a Googler working to level the playing field for communities that have unequal access to technology and economic opportunity. Lucy is also an active member of the NYC chapter of HOLA, our Hispanic Googlers Network, where she’s worked on efforts including a workshop for Latina small business owners and a tech immersion day for K-12 students. #HispanicHeritageMonth",2016-10-12T20:23:55.000Z
na,24338,image,145,https://www.instagram.com/p/BLhO-AWDD6w/?taken-by=google,"Meet Dasha. She led planning for this year’s HOLA Leadership Summit in Washington, D.C. (bringing together more than 50 HOLA Googlers from across the world). She says her HOLA chapter in Chicago reminds her of her Ecuadorian family growing up: “Whether having dinner with another member's parents, or helping plan a quinceañera dance for a member’s daughter, our ties go beyond the walls of the office."" #HispanicHeritageMonth",2016-10-13T22:07:19.000Z
na,29959,image,223,https://www.instagram.com/p/BLjR3mnDORb/?taken-by=google,Nothing like some nougat to celebrate #NationalDessertDay. #AndroidAdventures,2016-10-14T17:11:08.000Z
na,18740,image,140,https://www.instagram.com/p/BLj1kEeDI45/?taken-by=google,"Meet Brendan and Olga, two leaders of HOLA, the Hispanic Googlers Network. As first-generation Americans whose families come from Hong Kong and Colombia, respectively, this dynamic duo teams up to help foster an inclusive culture for Hispanics, Latinos and their allies at Google. They say: ""Google is more than place to work, it's a familia committed to advancing our community through education, technology and civic participation."" #HispanicHeritageMonth",2016-10-14T22:23:03.000Z
na,31132,image,135,https://www.instagram.com/p/BLrIaRUjIcX/?taken-by=google,This week’s #MySuperG from @eyecandyberlin is giving us some sparkling new ideas. 💡✨,2016-10-17T18:22:25.000Z
na,37348,image,339,https://www.instagram.com/p/BLtpJqXjZdh/?taken-by=google,We're a dog-friendly company. Visit any Google office and you're likely to meet a #Doogler or two. We want to introduce some of them — starting with El Chupacabra (nickname: Chuppie). Chuppie spends his days in our San Francisco office and loves giving high fives. 🐶,2016-10-18T17:46:59.000Z
na,16310,image,73,https://www.instagram.com/p/BLzPbRNj3W2/?taken-by=google,"We're at the Grace Hopper Celebration of Women in Computing and our booth is buzzing. If you're at #GHC16, join us there to chat about all things Google and #womenintech!",2016-10-20T21:57:39.000Z
na,43346,image,200,https://www.instagram.com/p/BL1g1cRDY_H/?taken-by=google,Come meet the #MadeByGoogle family of hardware. We’re popping up in NYC and would love to see you there!,2016-10-21T19:08:15.000Z
na,46358,image,349,https://www.instagram.com/p/BL9d5rnj-Sh/?taken-by=google,What better way to start the week than with a healthy plate of #MySuperG veggies? This colorful creation courtesy of @navideh — tag your own interpretation of our logo and we’ll share our favorites each week!,2016-10-24T21:16:32.000Z
103553,21667,video,336,https://www.instagram.com/p/BKV9DC1jfu4/?taken-by=google,"#Doodle4Google is swinging back into action! We're looking for young artists to submit work on the theme ""What I see for the future."" Hit the link in our bio to learn more.",2016-09-14T16:27:41.000Z
na,25379,image,302,https://www.instagram.com/p/BKZLIDXjIMS/?taken-by=google,"Spotted by @alliemtaylor: the Aialik Glacier calving in Kenai Fjords National Park. See the park for yourself and even climb inside a glacier in the #HiddenWorlds of the National Parks → g.co/nationalparks
📷: @alliemtaylor",2016-09-15T22:28:25.000Z
210323,28995,video,"1,559",https://www.instagram.com/p/BKjtIIpDxr2/?taken-by=google,October is coming. #madebygoogle,2016-09-20T00:37:56.000Z
na,43244,image,272,https://www.instagram.com/p/BKqt13Vjek1/?taken-by=google,"In @hawaiivolcanoesnps, @chelseakauai and @travisburkephotography explore an underground tunnel — created by lava 500 years ago — as it emerges into a tropical rainforest full of birds and ferns. Discover this lava tube in 360 degrees in the #HiddenWorlds of the National Parks → g.co/nationalparks",2016-09-22T17:58:52.000Z
na,35078,image,667,https://www.instagram.com/p/BKwJe41jOM6/?taken-by=google,Get ready for something big. #madebygoogle,2016-09-24T20:36:36.000Z
121284,36894,video,"1,083",https://www.instagram.com/p/BK3M1M9D28-/?taken-by=google,Happy birthday to us! Google turns 18 today. 🎈🎉,2016-09-27T14:20:32.000Z
na,17483,image,224,https://www.instagram.com/p/BK4CiJ5DYp7/?taken-by=google,"It's #NationalVoterRegistrationDay. Just search ""how to register to vote"" for the info you need to make sure your voice is heard this fall. #IRegistered",2016-09-27T22:09:48.000Z
na,48560,image,364,https://www.instagram.com/p/BK9Sv7TDGM7/?taken-by=google,Happy #NationalCoffeeDay! This #MySuperG comes to us piping hot from our friends in the Google Colombia office. ☕️ Tag your interpretation of our logo and we’ll share our favorites.,2016-09-29T23:07:41.000Z
